Transaction_id,Account_id,Transaction_type,Amount,Transaction_date,Description
4701,1296,Transfer,325.79,07/19/24,Writer defense relationship future.
4702,199,Withdrawal,4625.2,04/07/24,Heavy pretty eye compare.
4703,2756,Transfer,1257.8,05/11/23,Off practice little accept grow small.
4704,3561,Deposit,4428.51,09/18/24,Billion recognize realize discuss enough beyond.
4705,1703,Transfer,2076.38,06/03/23,Could building peace various.
4706,1229,Withdrawal,620.27,03/19/24,Last area message kitchen blue service.
4707,4621,Transfer,3787.14,06/08/23,War significant child certainly.
4708,254,Transfer,3111.21,01/07/23,Simply away service dog city.
4709,1507,Deposit,1629.7,12/23/22,Nothing ago nation painting miss.
4710,1595,Withdrawal,4522.91,03/02/24,Too series late world.
4711,1906,Transfer,4866.79,02/08/23,Ever must executive.
4712,3463,Withdrawal,944.73,01/30/24,High visit sign how.
4713,1446,Withdrawal,274.29,11/09/24,Spring for small threat physical staff.
4714,154,Withdrawal,2542.57,02/28/24,Doctor case arm brother reduce American.
4715,3198,Withdrawal,2751.75,11/22/24,Walk claim financial particularly.
4716,2114,Withdrawal,732.31,06/08/23,Visit ready course.
4717,3710,Transfer,2053.58,08/24/24,Middle cold law bill risk.
4718,4406,Withdrawal,2456.86,08/27/24,Argue seven likely realize send.
4719,985,Deposit,3301.74,10/02/23,Eight attorney such.
4720,2156,Transfer,4919.24,05/10/23,Form sign bit.
4721,2709,Transfer,996.57,07/25/23,Cut less blue position.
4722,718,Deposit,2773.19,07/28/23,They daughter thought pretty.
4723,3535,Deposit,2427.54,09/02/23,Base report turn method.
4724,2825,Transfer,710.22,10/07/24,Interest wonder environmental some.
4725,3491,Transfer,2373.33,07/19/23,Face clearly not.
4726,155,Withdrawal,4214.74,10/18/24,Tend even business today reason source government.
4727,1152,Deposit,1777.31,10/20/23,History us against.
4728,2651,Transfer,2393.33,07/18/23,Before and probably store.
4729,2482,Transfer,2756.31,11/01/24,Accept board ability natural forward.
4730,654,Withdrawal,592.88,10/23/24,Black send ground economy yet.
4731,387,Withdrawal,1420.83,06/19/24,Far then blue foreign growth able.
4732,78,Deposit,1977.86,08/24/24,Activity four far.
4733,3522,Withdrawal,2421.49,02/25/24,Manager enough candidate media another.
4734,4543,Withdrawal,3118.99,11/03/23,Poor clear watch alone certain must.
4735,3192,Deposit,413.04,05/21/23,Nearly information expert order.
4736,2124,Withdrawal,3789.97,11/16/24,Responsibility fish watch.
4737,305,Deposit,2099.19,06/10/23,Then amount customer.
4738,913,Deposit,4421.51,11/29/23,Surface culture back statement physical memory.
4739,2246,Deposit,3985.21,05/06/24,Herself media imagine may action simple.
4740,3096,Deposit,1148.82,09/04/23,Experience recent modern summer lay.
4741,4260,Transfer,1854.04,12/06/23,Road heavy cover hit difficult.
4742,3784,Withdrawal,3933.68,10/03/24,Piece letter visit.
4743,3601,Deposit,2429.44,01/13/23,Study authority almost lead last him.
4744,4449,Transfer,1198.67,12/02/22,Go tonight decision.
4745,3362,Withdrawal,448.42,02/22/24,Benefit go attorney.
4746,540,Withdrawal,3275.64,07/06/23,Wall treat modern view boy small.
4747,4838,Withdrawal,4002.31,07/17/23,Member local should.
4748,2621,Deposit,2844.65,12/16/22,Fund occur administration arm source candidate.
4749,778,Withdrawal,227.22,10/22/24,Half black at food senior.
4750,3940,Withdrawal,2645.61,02/15/24,Ground be ten.
4751,1534,Withdrawal,811.09,09/02/24,Cause your say environmental.
4752,3623,Deposit,3174.97,07/25/24,Rest religious factor the red.
4753,3704,Transfer,2253.22,08/15/23,Coach process federal special color.
4754,4547,Withdrawal,863.51,03/09/24,Prepare once thank.
4755,3558,Transfer,1273.05,02/05/24,Benefit these morning stock side network.
4756,411,Transfer,4929.87,10/23/24,Next choice small.
4757,1066,Deposit,1365,01/10/23,They stock small view.
4758,1978,Withdrawal,3536.79,07/09/23,Work development which science town admit.
4759,1249,Deposit,3706.98,03/12/23,Personal design event.
4760,3097,Deposit,622.32,04/08/24,Letter play green run else.
4761,4156,Withdrawal,950.84,05/30/23,Without simple effort job drop risk.
4762,1950,Deposit,3590.73,06/10/23,Smile animal inside police generation stop.
4763,2254,Transfer,3797.68,08/04/24,Leg finally at.
4764,3503,Withdrawal,1399.84,09/19/23,Various difficult require certainly campaign.
4765,960,Withdrawal,2761.21,11/08/23,Argue sure night.
4766,4319,Withdrawal,813.24,10/01/24,Ok eye although somebody event chance.
4767,4816,Withdrawal,1265.61,07/12/23,Order officer another.
4768,1233,Transfer,765.94,04/11/23,Material practice defense spend.
4769,83,Withdrawal,2281.39,07/08/24,Bill someone western tonight.
4770,3377,Deposit,3800.12,03/05/23,Wonder safe well.
4771,2172,Deposit,518.47,08/09/23,Movie positive civil.
4772,4924,Transfer,3555.66,07/02/23,Individual as cell with experience discussion.
4773,2356,Deposit,3283.9,11/26/23,Different either oil small.
4774,3814,Transfer,2819.82,10/03/24,Past wrong morning program study one.
4775,4641,Transfer,4344.22,12/07/22,Memory couple sport western wind change off.
4776,1691,Deposit,1634.47,11/27/23,Structure child evening least whatever indeed.
4777,1991,Transfer,954.28,09/09/24,Often language house see.
4778,3356,Transfer,1741.81,08/19/24,Community reveal thought decade suffer size.
4779,1482,Withdrawal,196.66,05/24/23,Authority reason trip.
4780,1152,Transfer,1792.1,12/08/22,Score thus nor rock item speak.
4781,2012,Transfer,384.63,03/09/24,Perhaps common live nation true condition.
4782,183,Deposit,1784.15,03/17/23,Commercial unit possible big.
4783,4718,Transfer,981.97,06/23/24,Foot claim until drug record along.
4784,4342,Transfer,343.54,08/17/23,Cultural face special environment hold.
4785,4635,Transfer,3277.01,08/07/23,Court rule eight.
4786,3124,Transfer,2734.87,12/27/23,Civil both boy your may process.
4787,1668,Transfer,1350.82,05/05/24,Yourself strategy through population.
4788,4333,Withdrawal,172.66,09/22/23,Member about may brother practice.
4789,204,Deposit,3727.71,08/12/24,Rise type area make smile news know.
4790,812,Deposit,936.8,03/09/24,Or follow necessary move.
4791,3665,Deposit,1142.77,12/27/23,Improve bank beyond raise look common.
4792,1844,Withdrawal,1103.54,06/16/24,Color present else make ago dark.
4793,3980,Transfer,2656.55,11/10/23,Hear tough traditional.
4794,3600,Transfer,4526.67,07/07/24,Full place we box.
4795,1568,Transfer,2191.11,05/20/23,Resource second society.
4796,2552,Transfer,359.33,09/18/24,Kind activity box.
4797,2332,Deposit,1882.02,05/13/23,Think employee perform western as.
4798,495,Transfer,103.94,12/09/23,Itself focus guess paper.
4799,3015,Deposit,2299.48,01/30/23,Exist lawyer per level expert.
4800,237,Deposit,484.97,06/21/24,Street able rest.
4801,528,Withdrawal,2563.47,03/19/24,Few TV owner nature.
4802,4540,Withdrawal,2773.92,12/28/22,Will buy interesting during.
4803,1138,Deposit,3163.83,09/09/23,Whose sea add far.
4804,3818,Transfer,4073.54,08/24/23,Fish need most TV interview.
4805,916,Withdrawal,2721.59,01/30/24,Read green tree project.
4806,4513,Withdrawal,547,10/25/23,Morning remember cut.
4807,2802,Deposit,4083.53,04/14/24,Never such should field.
4808,2935,Deposit,3168.53,01/26/24,When read local heart street fine.
4809,4365,Withdrawal,1541.91,09/27/23,We range win remember.
4810,3797,Transfer,1653.55,04/24/24,Yet focus idea see network.
4811,4998,Transfer,2187.55,09/06/24,Course like community little.
4812,640,Deposit,1013.64,04/21/24,Poor tree plant.
4813,4074,Deposit,1018.31,09/15/23,Smile player audience money.
4814,2010,Deposit,4829.88,01/30/24,Crime social fund.
4815,281,Withdrawal,4577.27,12/30/23,Age key edge term.
4816,4627,Deposit,316.59,08/30/24,Plant weight individual into individual while.
4817,447,Transfer,2288.94,07/19/23,Main draw tell hope position federal.
4818,2798,Deposit,3269.47,08/02/24,Whatever despite west source.
4819,208,Withdrawal,3449.1,12/18/22,Country store represent nation guess who.
4820,3119,Deposit,1232.7,08/16/23,Allow piece plant involve.
4821,730,Transfer,3791.14,10/09/24,Candidate blood behavior to go special.
4822,767,Deposit,367.91,01/13/23,You site may.
4823,1274,Withdrawal,2466.74,02/15/24,Brother body more.
4824,68,Withdrawal,3282.39,10/29/24,Like model rich the.
4825,2848,Transfer,4225.38,10/10/23,Kind stage person style line.
4826,4949,Transfer,60.4,09/10/23,Minute some bad himself crime blue.
4827,3584,Transfer,2251.45,10/24/24,Even instead wind what black.
4828,2489,Deposit,4544.18,08/23/24,Too finally trade network.
4829,2986,Deposit,3532.29,01/19/24,Plant rest again subject TV.
4830,2270,Deposit,3228.14,07/05/24,However career air.
4831,3582,Deposit,4690.24,04/04/24,Government senior second.
4832,1032,Transfer,1968.36,12/29/22,Rest affect class lay.
4833,3991,Transfer,1494.54,02/27/24,Everything wind upon maintain together happen.
4834,3108,Withdrawal,2324.89,11/27/24,Interesting between third.
4835,1684,Deposit,535.62,04/19/24,Indeed team strong.
4836,4949,Deposit,2842.14,01/17/24,Rule board friend into listen season.
4837,3793,Transfer,2053.48,02/12/23,Do about Congress arm.
4838,3402,Deposit,4960.28,01/07/23,Choice might minute.
4839,4957,Withdrawal,142.99,04/25/23,Bag try act seven can.
4840,4397,Transfer,4532.45,03/07/24,Edge until short method some.
4841,2281,Deposit,4320.23,02/28/23,Weight style throw part become rise address.
4842,4049,Withdrawal,1670.76,09/29/23,Ever position mouth another little economic.
4843,3273,Withdrawal,2342.7,02/22/24,Lay husband determine end alone entire.
4844,733,Deposit,4641.8,02/11/23,Out inside establish green throw property.
4845,3614,Deposit,2549.72,08/29/24,Or particular mind future explain.
4846,347,Withdrawal,3551.26,08/23/23,Chance war family decade.
4847,4672,Transfer,2187.08,08/27/24,Quite decision city.
4848,3970,Transfer,2335.28,07/19/23,Hospital final type right.
4849,848,Deposit,991.05,10/19/23,Down rich deep beautiful body room.
4850,2801,Transfer,3340.29,05/31/23,Commercial property leave toward.
4851,4346,Withdrawal,3128.08,12/24/22,Recently a operation should catch.
4852,2572,Withdrawal,2233.96,12/16/22,Many himself those ready finally including.
4853,1759,Transfer,2844.43,01/12/23,Easy child expect state.
4854,2879,Transfer,4503.18,12/09/22,Away court church character.
4855,4206,Withdrawal,1102.52,12/12/23,Father price throughout science.
4856,2523,Transfer,2599.17,12/08/22,Foreign child high these type once.
4857,3210,Deposit,2154.03,04/01/23,Fear option individual with administration.
4858,1880,Withdrawal,1169.78,09/18/23,Join never exactly dark.
4859,3995,Deposit,3612.53,05/25/24,Believe institution medical cup local agent.
4860,2321,Withdrawal,2984.08,01/10/23,Three game pressure member memory responsibility.
4861,119,Withdrawal,3893.72,06/28/24,All reality professional order both suggest.
4862,701,Deposit,4300.9,11/14/24,My meet at couple role choice.
4863,728,Transfer,2610.26,04/17/23,Continue world where theory magazine parent.
4864,3213,Deposit,2614.42,05/27/24,Check sometimes prevent.
4865,2273,Transfer,2848.91,07/25/23,Side next reality for name.
4866,4211,Deposit,672.35,04/08/23,Successful too campaign final magazine leave.
4867,1272,Deposit,1194.16,11/23/23,Money bad try.
4868,1978,Withdrawal,287.57,05/11/23,Clear people need song something.
4869,3424,Transfer,2718.93,10/24/24,Girl involve remain modern.
4870,845,Withdrawal,4212.97,10/22/23,Whether single mean.
4871,4821,Transfer,3222.19,10/29/23,Likely voice door expect.
4872,1115,Deposit,4525.55,05/19/24,Poor mention toward.
4873,3908,Deposit,1634.79,03/04/23,Tax believe seem writer heart condition.
4874,2029,Withdrawal,3676.16,01/23/23,Center financial become.
4875,1515,Deposit,1741.77,02/06/23,Radio machine court everybody.
4876,606,Transfer,4915.1,08/10/24,Several game nor Democrat stay position.
4877,4932,Withdrawal,1400.22,03/16/24,Campaign Mr knowledge garden professor analysis.
4878,2174,Withdrawal,2284.68,01/20/23,Military low order water summer question.
4879,1677,Deposit,3192.96,02/06/23,Reach trial race cause.
4880,261,Deposit,4909.45,04/14/23,Fear you parent.
4881,1634,Withdrawal,3964.69,09/22/24,Deep dark central push debate.
4882,614,Deposit,3463.59,01/09/24,Cover too eat agent analysis treatment.
4883,3352,Transfer,1020.45,03/05/24,Probably traditional quickly north pattern decade.
4884,586,Withdrawal,1278.43,08/25/23,Age item growth draw tough.
4885,472,Withdrawal,1044.47,12/02/23,Republican when training Democrat responsibility.
4886,2034,Deposit,3760.27,02/09/23,You same theory ago north.
4887,294,Transfer,972.32,04/19/24,Girl note gas tree shoulder campaign.
4888,4696,Deposit,700.45,01/26/24,Own not thousand.
4889,2332,Withdrawal,3710.41,04/21/23,We attorney light knowledge.
4890,2910,Deposit,3427.72,04/14/23,Ball garden five moment development.
4891,3202,Withdrawal,2146.68,07/09/23,Could ground evidence ten.
4892,3187,Transfer,811.51,05/11/23,Letter article social run.
4893,2411,Transfer,1223.82,11/30/24,Blood base suffer process page.
4894,83,Withdrawal,3876.21,04/03/24,Step enough officer physical.
4895,960,Deposit,2143.92,11/27/24,Movie trial bed.
4896,1481,Withdrawal,4785.77,02/05/24,Government young one do her.
4897,4449,Withdrawal,4762,02/15/23,Send share rise seek around recognize.
4898,2174,Deposit,621.94,04/11/23,Arm mind thank partner.
4899,3867,Transfer,3570.71,06/10/23,Account born everything.
4900,2894,Deposit,4328.34,10/07/23,Thus among strategy.
4901,4310,Deposit,2870.31,07/24/23,Sell everything sit popular claim.
4902,118,Withdrawal,3831.16,03/21/24,Itself free reason.
4903,282,Transfer,1235.56,11/30/24,Already store while.
4904,3883,Transfer,2557.62,02/08/24,Article someone college.
4905,3573,Deposit,2622.9,01/20/23,Play program house these.
4906,1775,Withdrawal,273.04,11/09/23,Color bit since.
4907,1960,Transfer,3097.59,08/26/24,Into risk if system know truth.
4908,2934,Withdrawal,1192.44,02/28/23,Campaign my some.
4909,1692,Withdrawal,2086.37,11/20/24,Same stock within recognize mission.
4910,2118,Withdrawal,525.14,12/06/23,Customer impact knowledge.
4911,2784,Transfer,396.93,10/11/23,Class live test analysis.
4912,2585,Deposit,1556.38,08/20/24,Floor leg because analysis town note.
4913,4083,Withdrawal,3025.44,07/02/23,Child might go.
4914,2696,Transfer,1825.09,08/21/24,Room else receive clearly can company.
4915,401,Transfer,1355.63,06/28/23,Thus team leader reason particularly goal.
4916,4814,Deposit,4823.58,07/05/24,Best likely discover meeting write how.
4917,1731,Deposit,4496.71,09/20/24,Push drive machine leg campaign them.
4918,3408,Withdrawal,198.66,10/13/24,Dark more administration hope deal least.
4919,4432,Withdrawal,493.27,07/18/23,Letter organization red if important.
4920,3048,Withdrawal,2019.66,03/26/24,Meet arm always trade century.
4921,4459,Transfer,3190.92,02/20/24,However someone value.
4922,3927,Transfer,2361.55,04/26/24,Home arrive hit.
4923,1386,Withdrawal,3457.69,08/29/23,Whether pull quite agree answer if.
4924,865,Deposit,2125.24,07/26/23,Day wide care.
4925,2240,Transfer,530.02,11/02/23,Message upon matter show thing.
4926,1814,Deposit,58.55,09/02/23,When movie generation.
4927,2383,Withdrawal,37.33,05/01/24,Produce boy game toward.
4928,1190,Transfer,274.61,10/19/23,Always happen start.
4929,3050,Deposit,2883.56,12/02/22,Million either miss last very.
4930,107,Withdrawal,2125.74,01/23/23,Inside bit consider best join.
4931,2376,Transfer,1129.56,07/29/23,Single owner establish manage mission.
4932,3150,Transfer,4967,05/09/23,Approach figure together performance statement.
4933,289,Withdrawal,4583.2,11/07/24,Security budget take than travel.
4934,3305,Withdrawal,4266.39,09/15/24,Environmental peace baby before produce.
4935,4013,Withdrawal,2232.45,06/04/24,What state recent edge size.
4936,3512,Deposit,3776.51,01/13/23,Couple military reveal seek senior kind player.
4937,1680,Deposit,4970.66,07/29/24,Toward child individual your store forget.
4938,3100,Withdrawal,4124.47,04/08/24,Government every down think long.
4939,2089,Withdrawal,1631.61,11/06/23,Significant foreign century.
4940,712,Withdrawal,1038.09,05/04/24,Evidence color police beat.
4941,1627,Deposit,3826.21,04/21/24,Probably billion as particularly arm happy.
4942,368,Transfer,3933.59,01/15/23,Green bar increase.
4943,3034,Withdrawal,2703.92,09/22/24,Line walk film service.
4944,3628,Withdrawal,3301.76,05/21/23,Stay those state skin soldier.
4945,3431,Transfer,2320.59,04/29/24,Be ability manage ask space carry.
4946,4893,Transfer,4992.23,05/15/24,Pick mention middle.
4947,2874,Transfer,703.38,06/24/24,Degree radio meet.
4948,400,Transfer,3199.99,12/20/23,Mother best animal truth.
4949,2500,Transfer,3873.85,04/11/24,Operation property challenge draw role star.
4950,1677,Transfer,4307.02,05/09/24,Local son staff forget I mother.
4951,279,Withdrawal,2015.09,10/28/23,Commercial religious product various.
4952,2585,Transfer,2111.39,10/29/23,Marriage feel black.
4953,814,Transfer,4720.54,09/26/24,Sure reach particular in according.
4954,4295,Transfer,4970.37,08/30/23,Crime thought tax fish.
4955,888,Transfer,851.48,07/25/24,Garden data anything cover.
4956,2209,Deposit,3919.81,03/10/24,Drop close example least.
4957,2700,Deposit,1290.73,04/06/24,Region challenge information often trip.
4958,1076,Withdrawal,611.13,07/30/24,Already TV population under easy left.
4959,1763,Deposit,353.45,12/30/23,Moment teacher team yourself teacher.
4960,3116,Deposit,2948.2,03/11/23,Need talk born.
4961,3889,Deposit,229.92,10/01/24,Scene truth fund trouble.
4962,3892,Withdrawal,4285.22,08/10/23,Husband step speak together watch something.
4963,3388,Deposit,3288.33,06/25/23,Public beautiful camera card home fine.
4964,1505,Deposit,4314.02,11/28/24,Seem claim dream begin decade drug.
4965,4384,Deposit,575.05,08/26/23,Whatever heart page.
4966,1530,Withdrawal,4451.71,05/26/23,Break little thousand respond and cost.
4967,4535,Withdrawal,2763.84,05/14/23,School start chance.
4968,3510,Withdrawal,3513.2,07/23/24,Seven site program both.
4969,2313,Withdrawal,1919.35,07/31/23,War quality popular very.
4970,4013,Transfer,2406.5,01/18/24,Even bank action movie wall certainly.
4971,1229,Deposit,452.08,04/08/24,Her begin soldier decision.
4972,1096,Deposit,3581.63,09/14/24,Year prevent safe.
4973,2089,Deposit,3881.34,03/22/23,Impact player ago its.
4974,691,Deposit,4432.9,06/26/23,Music side perform nearly.
4975,468,Transfer,340.06,12/02/23,Option protect machine sing ahead know.
4976,3782,Deposit,563.22,05/22/23,Network goal week former.
4977,697,Deposit,1297.95,03/18/24,Agreement better best.
4978,144,Withdrawal,3282.1,07/10/23,Event run marriage traditional.
4979,907,Withdrawal,3812.03,03/03/24,Dinner voice prove develop off future.
4980,3066,Withdrawal,124.99,05/18/24,Claim himself size.
4981,80,Withdrawal,862.62,04/08/24,Matter expect cup risk.
4982,2564,Withdrawal,3278.81,06/13/23,Work level with culture shoulder never.
4983,89,Deposit,3165.82,08/25/23,Account page set fall.
4984,2034,Deposit,983.4,08/04/23,Relationship outside huge second write.
4985,4990,Transfer,58.44,07/13/24,Gas factor quickly some.
4986,1180,Transfer,2860.32,05/16/23,Thank table pretty first administration live.
4987,2946,Withdrawal,4564.74,06/18/23,Step entire however site.
4988,4944,Transfer,2541.08,04/01/23,Energy film either quite else.
4989,3903,Withdrawal,3141.15,08/18/24,Better tell member.
4990,3233,Deposit,3597.33,05/24/24,Him tend sing score training.
4991,2133,Withdrawal,4288.9,10/06/23,Walk or raise.
4992,4088,Withdrawal,4797.46,06/21/24,Or send east rule represent.
4993,1922,Deposit,3364.1,02/07/23,Expert property risk middle realize.
4994,2438,Deposit,907.26,06/19/24,Board wall leader for human charge.
4995,2055,Transfer,838.28,09/12/23,And market general simple.
4996,4494,Withdrawal,1912.68,09/06/24,Day wife modern receive.
4997,545,Deposit,3224.34,05/08/23,Into know range fear white wear.
4998,926,Withdrawal,3730.46,08/08/24,Type red color.
4999,1285,Deposit,4446.97,05/22/24,National pressure bill recent.
5000,4262,Transfer,2305.24,05/16/24,Like foot ground least.
5001,4949,Withdrawal,3260.26,04/09/24,Structure occur management.
5002,3811,Transfer,3715.98,12/28/22,Recognize past president.
5003,3117,Deposit,3154.48,12/25/22,Play middle special.
5004,259,Deposit,1558.45,02/21/23,Accept available protect unit imagine.
5005,1829,Deposit,1063.58,01/17/24,Its fish loss level.
5006,159,Withdrawal,2417.46,07/30/23,Very decision natural arm.
5007,2194,Deposit,4220.73,07/15/23,Race I program.
5008,430,Deposit,38.03,06/19/23,Trip lawyer rise this cold region.
5009,3241,Transfer,2241.24,06/02/23,Million lead appear effect.
5010,4523,Deposit,4717.24,10/31/23,Course above new school card wall.
5011,4545,Deposit,64.72,09/06/23,Thought last effect tell everything.
5012,3784,Transfer,1021.4,02/01/24,Job become set how.
5013,2254,Transfer,4242.74,03/31/24,Computer cultural hospital maintain table.
5014,1740,Withdrawal,380.86,01/20/23,Song large knowledge modern red.
5015,2298,Withdrawal,220.69,06/13/23,Street somebody last.
5016,4788,Withdrawal,1598.73,06/18/23,Billion benefit list total staff.
5017,4107,Withdrawal,4234.33,09/24/23,Maintain material care.
5018,3436,Deposit,983.68,01/26/24,Mr late former avoid.
5019,2300,Withdrawal,4061.07,09/13/24,Economic his however key.
5020,2321,Transfer,3895.82,10/24/24,Region series when.
5021,1554,Withdrawal,1481.79,10/28/24,Tonight do system new receive realize.
5022,662,Transfer,4427.19,07/01/23,Apply concern large decision.
5023,4316,Withdrawal,447.33,03/31/24,Within account draw president international.
5024,1795,Deposit,4400.81,10/09/23,Open usually process short.
5025,1282,Transfer,2602.5,03/15/24,Drive myself hot local child.
5026,915,Transfer,3675.29,02/23/24,Do plan none your fall its.
5027,1271,Deposit,1447.04,06/26/24,Toward with development relationship.
5028,3773,Transfer,3256.35,12/19/23,Program rock probably situation set fly.
5029,2724,Transfer,3346.01,01/05/24,Goal phone black grow occur subject.
5030,4564,Transfer,4677.36,08/22/23,Agreement third story brother town imagine.
5031,410,Withdrawal,652.94,01/12/24,Be parent lawyer gas particular according loss.
5032,263,Withdrawal,885.58,07/15/24,Other bed visit wide price time.
5033,2694,Deposit,1344.8,04/16/24,Tax box five safe.
5034,4396,Withdrawal,2134.17,09/06/24,Director radio crime man especially although.
5035,777,Withdrawal,1721.13,08/29/23,Good dark wear.
5036,855,Deposit,3221.63,05/20/24,Statement college themselves hand indeed charge.
5037,737,Deposit,4308.66,10/30/23,Sign according organization face teach collection.
5038,2992,Withdrawal,4587.79,02/29/24,Above focus event kid nothing director.
5039,560,Transfer,4188.84,10/22/23,Check firm more really prove kitchen.
5040,2559,Deposit,3110.92,04/28/23,Attorney card less answer beat.
5041,3470,Deposit,1993.3,09/07/23,Nearly blue manager next pressure.
5042,2804,Deposit,4814.57,07/20/24,Base break piece involve.
5043,1198,Transfer,4198.71,09/24/23,Manager little really science list.
5044,1480,Withdrawal,2785.28,10/02/23,About draw friend result.
5045,2230,Withdrawal,1545.65,12/02/22,Send wife seat yeah argue group.
5046,3031,Deposit,41.94,12/30/22,Public drive individual find science.
5047,3544,Withdrawal,4798.71,08/14/24,At good himself several rule.
5048,3472,Transfer,4340.71,10/02/24,Baby effort participant weight sort.
5049,4258,Transfer,4282.58,08/18/24,Baby likely your sing consumer.
5050,4858,Withdrawal,4596.27,11/16/24,Director political authority prevent rate box.
5051,3077,Transfer,1657.68,05/08/24,Risk across political.
5052,1877,Transfer,255.77,10/08/23,Research million soon.
5053,665,Deposit,2779.33,07/16/24,Board manage may.
5054,2959,Deposit,3534.33,10/04/24,Thus set institution would investment.
5055,1117,Transfer,4411.65,04/08/23,Position feel leader.
5056,703,Withdrawal,4158.19,07/09/24,Federal kitchen contain choose deep.
5057,4860,Withdrawal,2316.79,08/14/23,Share investment example price art huge.
5058,2373,Transfer,1638.48,03/14/23,By beyond glass matter.
5059,4876,Deposit,4706.94,05/13/23,Out second claim.
5060,1832,Withdrawal,545.07,02/25/24,Newspaper record particular much age home.
5061,4275,Transfer,3880.96,07/01/23,Food strong very sort share wall.
5062,944,Transfer,4384.67,11/12/23,Boy special whether need this.
5063,4796,Withdrawal,2984.97,04/21/24,Thing tax vote group.
5064,1581,Deposit,3007.18,04/04/23,Forward citizen work which drive nearly.
5065,1742,Transfer,1008.63,04/01/23,Citizen far scientist level take against.
5066,4467,Transfer,3102.05,02/24/24,Add catch expect of.
5067,1253,Withdrawal,650.61,12/07/23,Affect local rise candidate physical.
5068,22,Deposit,2701.5,11/03/24,A Mrs paper sing.
5069,3449,Withdrawal,2223.94,03/20/24,Leg ever purpose box though.
5070,4419,Deposit,3142.22,10/07/23,Relate station price across.
5071,771,Deposit,1177.84,11/22/23,Development environmental ahead work.
5072,594,Deposit,1069.5,09/17/23,Own indicate easy probably.
5073,604,Transfer,2455.62,07/13/24,Sea contain spring support.
5074,1731,Transfer,2203.42,03/28/23,Environmental perform clear analysis.
5075,1710,Transfer,929.61,12/11/23,Under stay see trip tend successful.
5076,2212,Withdrawal,971.2,07/20/23,Entire stock move serve community.
5077,1001,Deposit,1787.25,07/03/23,Evidence laugh let these.
5078,445,Transfer,4226.6,09/05/23,Church military ask team itself year require.
5079,1511,Withdrawal,2497.54,07/13/24,Career event future bring institution to.
5080,2334,Deposit,3530.78,11/11/24,Today interest health now head rate.
5081,2992,Transfer,4939.01,09/06/24,Everyone artist sense necessary why.
5082,54,Transfer,1006.57,10/25/24,Region at center oil.
5083,640,Withdrawal,4359.62,03/15/23,Agency direction two interview rate other wear.
5084,2030,Transfer,1066.49,09/04/24,Media guess government free blood trade.
5085,1409,Withdrawal,3138.31,03/01/23,Part answer call trouble daughter.
5086,2772,Withdrawal,287.85,07/10/24,Per positive mention give side.
5087,1317,Transfer,341.56,01/07/23,Argue gas almost.
5088,1177,Withdrawal,4773.93,10/21/24,Prevent bit traditional whose.
