Transaction_id,Account_id,Transaction_type,Amount,Transaction_date,Description
2359,955,Transfer,1307.69,09/03/23,Artist political heavy listen.
2360,4066,Withdrawal,3266.34,06/28/23,Stuff walk month.
2361,4299,Transfer,83.29,10/02/23,Huge really light bank voice.
2362,2681,Transfer,990.32,04/24/24,Care top consider impact future very.
2363,1073,Transfer,2471.22,08/02/23,Majority expert picture might day.
2364,1777,Deposit,430.39,10/14/24,Television significant hot since sound report age.
2365,486,Withdrawal,4162.28,11/08/23,Magazine case attention.
2366,3372,Transfer,2205.86,08/22/24,Couple approach allow more available.
2367,895,Transfer,4298.21,05/22/23,Reflect suggest early several.
2368,2420,Deposit,3660.07,11/13/23,Sometimes capital wish.
2369,3998,Transfer,3005.68,04/30/24,Worry figure fish wind.
2370,3823,Transfer,4405.01,03/09/24,Buy good detail.
2371,127,Withdrawal,1222.79,05/13/24,Able vote decade senior.
2372,2031,Transfer,4501.9,04/28/23,Health short machine.
2373,1936,Deposit,1976.26,01/30/23,Despite fish bad security.
2374,4505,Deposit,4215.35,03/25/24,Fund audience back while run.
2375,170,Deposit,4649.01,02/08/24,Industry most expect small red.
2376,294,Transfer,1664.57,08/04/24,Leg approach learn art according another.
2377,2559,Transfer,3004.22,11/25/24,We necessary federal.
2378,269,Deposit,1554.31,07/20/23,Couple those themselves.
2379,1424,Transfer,618.54,08/26/24,Ever threat campaign hand during.
2380,634,Deposit,4295.81,10/11/23,Learn minute let loss early them.
2381,2012,Withdrawal,445.45,12/25/22,Street deep weight writer say down.
2382,600,Withdrawal,453.45,01/24/24,Model break blood thought travel.
2383,4933,Deposit,1059.71,11/08/24,Drive something live left follow.
2384,2683,Withdrawal,1255.7,03/16/24,Arrive street sea kitchen speak.
2385,4513,Deposit,436.47,06/06/23,Place consumer interest ground before.
2386,673,Transfer,2100.28,02/23/23,Thought charge student president cause still.
2387,2518,Transfer,3985.26,11/17/24,Safe capital stuff organization.
2388,3408,Transfer,832.84,05/02/24,Cup method natural hard.
2389,785,Withdrawal,4503.23,06/30/24,Save let hope free relate all tell.
2390,1188,Deposit,1973.06,03/08/24,Goal market level your science land.
2391,4793,Deposit,1756.93,04/11/23,Full forward money.
2392,288,Withdrawal,4255.21,06/12/24,Across employee bag wind none probably.
2393,2316,Transfer,1167.85,05/21/23,President example possible total lay three.
2394,1594,Withdrawal,2773.51,08/18/23,Over get mission manage.
2395,2123,Transfer,284.75,02/21/24,Experience reveal picture.
2396,939,Withdrawal,3848.47,05/12/24,Suggest owner nature share there.
2397,4028,Withdrawal,3186.34,01/26/24,Oil occur explain up.
2398,4413,Withdrawal,3323.49,05/14/24,Card arrive place city.
2399,4008,Withdrawal,642.37,06/07/23,Democratic perform natural.
2400,3489,Withdrawal,2940.95,06/14/23,Very vote his meeting education.
2401,4122,Transfer,4265.69,08/11/23,Art nation work.
2402,3789,Transfer,4689.25,12/02/22,Which value situation sometimes.
2403,1784,Withdrawal,3517.73,01/28/24,Indeed this likely human.
2404,4752,Deposit,1664.27,03/26/23,Society how too recently.
2405,1370,Transfer,3387.33,10/30/24,Heavy but follow south.
2406,1834,Transfer,1765.14,11/04/24,Itself less beat morning ground.
2407,4679,Transfer,2612.34,10/13/24,Almost condition tell seem about edge.
2408,530,Deposit,2169.9,10/28/24,Mrs team drop sign.
2409,1839,Deposit,3785.92,07/27/23,Police world lawyer social.
2410,916,Deposit,4528,10/13/24,International cell sort.
2411,4832,Transfer,4479.56,10/17/24,Task guess gas whatever whole full.
2412,4424,Transfer,3211.62,02/04/23,About purpose side region.
2413,2939,Deposit,4293.82,06/02/24,Picture certainly no spring.
2414,3863,Transfer,734.13,05/05/23,Inside election visit party.
2415,3849,Withdrawal,2162.81,03/21/23,Well run future TV meet.
2416,2454,Transfer,2339.46,11/18/23,Successful sound low role throw.
2417,176,Deposit,4570.45,11/19/23,Defense against whose central vote.
2418,2104,Deposit,2909.29,05/22/24,Marriage heart might.
2419,3018,Withdrawal,4596.17,06/24/24,Assume might none direction baby song.
2420,421,Deposit,683.22,07/03/23,Maybe art tree.
2421,4648,Withdrawal,4220.88,04/14/23,Here course walk station with upon.
2422,116,Deposit,12.76,07/07/23,General general blood both.
2423,2146,Transfer,1292.91,10/02/23,Past team task.
2424,3191,Withdrawal,1798.59,03/07/24,Provide director art hospital.
2425,2442,Withdrawal,2542.39,11/03/24,Add expert young.
2426,3670,Withdrawal,3278.1,10/24/23,Region hold somebody final field store.
2427,837,Transfer,1649.66,08/12/24,Notice small ask.
2428,1664,Withdrawal,1971.33,04/04/24,Project data off color.
2429,395,Deposit,1116.15,12/19/23,Citizen know case agreement our.
2430,77,Transfer,20.09,04/02/23,Chair trouble up treat for position.
2431,565,Deposit,913.77,04/01/24,Especially do present most.
2432,80,Withdrawal,618.62,09/20/24,Better second she guess point small.
2433,876,Deposit,2917.21,12/02/23,Film true hold.
2434,1667,Withdrawal,4110.99,07/29/23,Author note serious page international buy.
2435,1164,Withdrawal,4843.25,02/10/24,Sea research section require realize rise.
2436,2083,Deposit,1578.63,11/10/24,Industry high from role.
2437,4872,Withdrawal,1837.78,09/08/24,Kind quality stop best for weight.
2438,4810,Deposit,1184.18,03/06/24,Size know claim.
2439,3028,Withdrawal,2117.11,04/22/23,Door individual company car.
2440,1724,Withdrawal,420.93,11/22/23,Do million control contain.
2441,185,Transfer,1991.52,03/21/23,Wide process onto American.
2442,934,Deposit,1964.56,12/25/22,Serve rich Mrs human top.
2443,4036,Transfer,2928.36,02/19/23,Mission whole court many there.
2444,4101,Transfer,1722.63,01/14/24,Attorney yourself address interesting.
2445,2995,Transfer,2216.15,01/25/24,Congress tough coach kind quite.
2446,346,Deposit,2368.56,01/06/24,End also major game.
2447,893,Deposit,74.54,07/02/24,Material wife right.
2448,3904,Withdrawal,1420.88,07/19/24,Tough window realize travel.
2449,1255,Withdrawal,708.07,01/14/24,Light open financial hot may letter.
2450,4791,Withdrawal,3347.63,11/24/23,Certain actually special himself.
2451,2182,Transfer,4026.71,09/26/24,Send friend investment least design common.
2452,2016,Deposit,3262.06,07/14/23,Wonder on else.
2453,3588,Deposit,763.55,06/15/24,Source natural technology suffer.
2454,3588,Transfer,351.12,11/14/23,Build owner imagine least.
2455,2086,Transfer,3843.31,03/01/23,Standard national oil writer.
2456,624,Transfer,2322.69,07/18/24,Man thought give truth.
2457,2336,Transfer,2244.55,12/30/23,Mouth personal fly woman ever.
2458,3679,Transfer,4657.2,01/07/24,Lead situation just page.
2459,508,Transfer,4404.69,02/05/24,Leader front either.
2460,2769,Transfer,1488.13,11/07/23,Capital meeting cover stuff positive.
2461,3540,Deposit,3601.38,04/26/23,Possible power improve sell someone.
2462,60,Transfer,1948.38,01/25/24,Quickly friend base born he few.
2463,894,Withdrawal,4678.76,12/30/23,Course pay catch.
2464,194,Transfer,2965.07,05/09/23,Check game sure here.
2465,2328,Withdrawal,4452.2,01/15/24,Body sing want event west.
2466,1575,Transfer,3124.61,12/05/22,Kind only see return.
2467,1155,Transfer,1954.51,11/01/24,Beyond wind inside professor be education.
2468,4389,Deposit,2575.81,08/06/23,Born cause argue.
2469,4636,Withdrawal,2997.13,05/18/24,Happy by head.
2470,3369,Deposit,312.26,10/03/24,Idea only into number how.
2471,4195,Transfer,39.6,01/02/24,Mention put key suggest.
2472,3859,Withdrawal,1935.24,12/18/22,Occur claim wear wall avoid.
2473,1187,Withdrawal,2483.99,07/02/23,In here say ever.
2474,4658,Deposit,2337.9,12/01/23,Early partner cup.
2475,3848,Withdrawal,3303.46,04/05/23,Amount strategy source.
2476,1490,Deposit,3982.67,06/15/24,Choice indeed PM health.
2477,4840,Deposit,2133.94,12/05/23,Care kind write blue buy involve.
2478,2266,Withdrawal,359.93,05/14/23,Song wide religious speak.
2479,3181,Deposit,1597.1,04/05/24,Scene also kind.
2480,2316,Withdrawal,3134.53,04/09/24,True physical address executive federal father.
2481,1615,Transfer,3420.73,04/08/23,Price budget past.
2482,4077,Transfer,3735.18,08/13/23,Study store kitchen above.
2483,2705,Deposit,3073.99,12/11/23,Room life process wide.
2484,1944,Withdrawal,638.04,01/27/24,Increase career road laugh knowledge.
2485,315,Deposit,308.49,01/22/23,Though major imagine begin leader top.
2486,1848,Withdrawal,1839.96,04/02/23,Boy to dinner large government window.
2487,4264,Withdrawal,4643.5,06/16/23,Issue open try see heavy may.
2488,408,Deposit,4671.99,01/08/23,Get view parent listen.
2489,2014,Transfer,1175.27,11/29/24,International event energy expect.
2490,4577,Transfer,2895.18,05/13/24,List worker feeling indicate impact suggest.
2491,1316,Deposit,501.05,07/28/24,Staff already attorney.
2492,3749,Transfer,4657.26,11/03/24,Adult see hair debate ready.
2493,1699,Transfer,4966.47,12/17/23,Fight performance ago view security yeah serious.
2494,3691,Withdrawal,1828.47,12/06/22,Boy likely realize half.
2495,2685,Withdrawal,3587.84,12/04/23,Kid see dark down election success.
2496,736,Deposit,3188.21,04/26/23,Democrat life station trial protect network.
2497,3911,Deposit,4102.21,11/18/24,Out social cause determine.
2498,4715,Deposit,1857.76,06/02/23,Bad around business.
2499,881,Withdrawal,3060,12/04/22,Bag create write.
2500,4641,Transfer,2975.21,10/04/24,Couple common turn.
2501,912,Withdrawal,3886.55,07/19/24,Loss moment item rock set worry.
2502,776,Withdrawal,4624.85,06/07/23,West red stock among upon art.
2503,4195,Transfer,4168.76,11/05/24,Successful whole gun nice air.
2504,1468,Transfer,1108.28,01/18/24,Customer result test foot party wide.
2505,4326,Deposit,1101.84,10/29/24,Story might side agent.
2506,4768,Deposit,4027.63,07/07/23,Little cost box stuff same.
2507,3181,Deposit,2359.77,02/13/23,Bar town meet long clear again.
2508,2331,Transfer,828.27,07/12/24,Available show energy try.
2509,4687,Withdrawal,4090.2,05/21/24,Box summer join common whole.
2510,3303,Deposit,3950.4,12/02/22,Resource pick attack evidence.
2511,2620,Withdrawal,2641.34,07/15/24,Miss home away operation wall.
2512,180,Withdrawal,2433.18,02/06/24,Herself sell page firm begin.
2513,668,Transfer,4407.37,01/16/24,Box system cause pass item cultural election.
2514,3810,Withdrawal,4911.07,02/13/23,Third they population tough three TV.
2515,3411,Deposit,3541.53,04/19/23,Final performance money.
2516,1633,Deposit,3620,03/21/24,Population wish force current often listen.
2517,1015,Deposit,2719.11,11/15/24,Resource speech relationship book than.
2518,3945,Withdrawal,2176.8,09/20/24,Street any sing card fall doctor.
2519,2505,Withdrawal,2302.21,12/30/22,Late bed network sell site visit.
2520,1791,Deposit,2369.09,09/22/24,Which with want.
2521,4018,Transfer,4368.45,04/08/24,New receive be rule arrive.
2522,2390,Deposit,1296.15,09/19/23,Two happy live same threat price.
2523,1269,Withdrawal,2331.69,01/01/23,Guy clear each commercial.
2524,355,Withdrawal,1645.94,11/16/24,Build heart fine statement.
2525,3871,Transfer,3540.53,03/28/23,Total stand person off information wife.
2526,2517,Deposit,1518.9,12/10/22,Life never campaign.
2527,3434,Deposit,4727.41,07/02/23,Information ability explain.
2528,3113,Withdrawal,1451.72,08/06/23,Need scene important thank.
2529,3751,Deposit,2498.69,03/31/24,Voice their write.
2530,367,Withdrawal,2498.47,10/19/23,Third country able beautiful huge.
2531,336,Deposit,21.67,02/16/23,Set hit list your.
2532,3309,Transfer,3338.56,01/15/23,Near network month turn town.
2533,3379,Withdrawal,4078.99,04/30/23,Chance middle situation tough cold.
2534,1129,Withdrawal,2794.15,12/10/23,How yourself hear include game within.
2535,1341,Transfer,4682.29,09/29/24,Apply model method house that.
2536,3985,Transfer,4437.59,10/31/23,How court to maintain.
2537,2922,Transfer,2234.72,09/03/23,Particularly newspaper take.
2538,1156,Transfer,4926.76,04/13/23,Station knowledge sometimes.
2539,1605,Transfer,1047.53,02/20/23,Director plan bad.
2540,1982,Withdrawal,4905.18,10/17/24,Audience fish direction travel line.
2541,1893,Deposit,4018.97,04/10/24,Woman example leg.
2542,1508,Transfer,3321.25,06/28/24,Threat ready soon.
2543,1014,Withdrawal,153.01,11/16/24,Possible wife natural push drop.
2544,2373,Deposit,4581.71,01/10/23,Turn news character cup keep as.
2545,1769,Deposit,1091.76,11/25/24,South time late party image director.
2546,260,Withdrawal,730.72,09/21/24,Hope bed others.
2547,1106,Withdrawal,4114.71,04/13/23,Machine free resource.
2548,2262,Withdrawal,4680.7,12/17/22,Level data establish network participant son myself.
2549,4304,Withdrawal,3782.27,03/24/23,Training spend they radio.
2550,2713,Transfer,1427.59,08/19/23,Say person full many.
2551,4494,Withdrawal,3378.49,08/15/23,Bring special agree explain where position.
2552,3819,Withdrawal,169.91,05/29/24,Who drop when help.
2553,2414,Withdrawal,884.37,05/31/24,Firm model usually full right.
2554,3568,Transfer,2811.55,06/13/24,Capital current yard least large voice.
2555,3711,Withdrawal,4499.26,10/29/24,Purpose system season different them property.
2556,272,Transfer,3914.65,03/10/23,Something improve ahead TV.
2557,142,Withdrawal,84.53,03/20/23,Hear study drug support.
2558,4792,Transfer,1640.49,01/18/23,Often wide heavy.
2559,796,Transfer,1319.78,02/04/23,Available view hit.
2560,3155,Withdrawal,3206.84,05/24/24,Dinner idea south rate reflect.
2561,2275,Transfer,3134.03,04/24/24,Respond TV long past why.
2562,2481,Withdrawal,4651.37,07/25/24,Talk area wish stock ten box.
2563,1927,Transfer,3191.64,05/28/23,Agreement situation nearly start.
2564,3098,Transfer,1843.29,09/12/23,Quickly situation evidence into.
2565,2013,Transfer,4512.73,01/20/23,Ball necessary behavior which.
2566,552,Withdrawal,3901.74,01/01/24,Trade kind big.
2567,4292,Deposit,3588.64,02/08/24,Deep sometimes option soon international many.
2568,331,Deposit,3964.76,10/15/23,Traditional Mr as.
2569,3053,Deposit,3839.8,03/11/24,Need employee share five.
2570,1111,Transfer,3319.01,06/11/24,These dinner lead.
2571,1151,Transfer,3444.95,08/17/23,Ahead news lot next most attention.
2572,2239,Transfer,2101.01,02/13/23,Well force fact.
2573,4350,Withdrawal,2417.06,12/09/23,Public stand sort your.
2574,195,Transfer,1537.64,12/10/22,Cover single edge.
2575,3199,Deposit,3574.93,01/25/23,Growth news paper seven executive contain.
2576,4302,Deposit,4929.48,11/08/23,Off skill prepare.
2577,885,Deposit,1515.42,12/04/22,Value across kid deep man smile.
2578,1075,Deposit,2134.26,06/16/23,Player character drop politics gas.
2579,3946,Transfer,4962.76,03/30/23,Offer system generation body quickly.
2580,503,Withdrawal,2726.14,05/05/24,Put paper yes.
2581,120,Deposit,2363.88,09/07/24,Argue impact impact whom.
2582,523,Withdrawal,749.24,05/29/24,Prevent significant off investment.
2583,2864,Withdrawal,4862.46,07/27/24,Color artist nor let little guy.
2584,4766,Transfer,3745.91,11/11/24,Know less different.
2585,2801,Withdrawal,728.92,08/31/24,Actually most employee shoulder.
2586,1909,Deposit,2503.34,10/21/23,Within concern however.
2587,3043,Deposit,2723.73,08/02/24,Accept according five early.
2588,402,Transfer,2287.2,02/01/24,Class every take.
2589,1764,Withdrawal,3003.09,08/05/23,Talk unit note around seven claim.
2590,2726,Withdrawal,1075.39,06/06/24,Commercial job hear owner hard effort.
2591,1884,Deposit,4027.62,02/02/23,Leader my article maybe speech.
2592,3870,Deposit,1207.27,08/14/23,Speak study note career.
2593,4450,Transfer,646.21,06/29/23,Especially forget new.
2594,4857,Withdrawal,610.96,03/25/24,Everything consumer and argue get.
2595,2948,Deposit,796.24,02/01/23,Can together computer administration.
2596,224,Transfer,4121.09,03/19/24,Draw well find energy a collection.
2597,3183,Withdrawal,4009.84,02/09/23,Buy big young.
2598,1218,Deposit,2293.19,11/28/23,Them believe bar can.
2599,326,Withdrawal,1113.9,05/17/24,Real hair film.
2600,1987,Transfer,2381.51,04/07/24,Your art late fine participant.
2601,393,Withdrawal,2289.55,07/12/24,Thing agency necessary peace.
2602,4795,Withdrawal,3916.21,04/30/24,Response responsibility alone public.
2603,4711,Transfer,1987.32,06/03/24,Turn early argue lose avoid third.
2604,2033,Deposit,493.21,06/09/24,Later ahead away go remember.
2605,1805,Deposit,2657.57,10/28/24,Which order watch nearly exactly fine.
2606,3468,Transfer,176.97,04/06/23,Early environment suddenly sit way skill.
2607,2473,Transfer,2832.84,08/02/23,Although team project any religious tonight.
2608,1727,Deposit,1427.25,08/16/24,City fall without our American.
2609,2310,Withdrawal,3008.35,05/16/24,Thought five up response.
2610,4056,Transfer,4106.98,08/30/23,Owner near trip audience control.
2611,4332,Transfer,3743.76,09/19/24,That sometimes half.
2612,1021,Transfer,4135.37,09/23/23,Mention return help since become space.
2613,1611,Withdrawal,3682.7,12/21/23,Out off case.
2614,54,Deposit,3287.04,09/17/23,Job fight six.
2615,1978,Deposit,1444.74,04/21/23,Want bank those explain line shoulder.
2616,2058,Deposit,4384.59,10/18/23,Bill moment knowledge even use.
2617,4631,Deposit,3794.95,08/28/24,Data attack available.
2618,1246,Withdrawal,3134.88,11/28/23,Prove significant dark eight study.
2619,1697,Withdrawal,763.01,11/07/23,Wait happy least from step.
2620,2455,Transfer,4022.48,02/28/24,Catch how more ten.
2621,3711,Transfer,3995.89,09/23/23,Game interesting join.
2622,2727,Transfer,35.5,03/11/23,Though western media lawyer.
2623,2664,Withdrawal,4958.69,03/20/23,Way less with.
2624,2075,Deposit,3130.89,04/06/24,Newspaper almost truth contain box those.
2625,2309,Transfer,4598.18,12/17/22,Garden able writer wind white play.
2626,4040,Withdrawal,3642.19,04/17/23,Law able seek.
2627,1278,Transfer,3739.02,08/05/24,Official peace save part section.
2628,2089,Deposit,2490.18,07/22/23,Husband production according early future despite.
2629,1109,Deposit,1303.13,01/25/23,Those rate play at.
2630,665,Deposit,394.98,02/21/23,Agency project seem as.
2631,1085,Withdrawal,297.52,07/01/23,Year piece end including health center.
2632,2652,Deposit,761.74,02/05/23,Today arrive total different price.
2633,1471,Deposit,615.81,09/11/23,Grow share goal.
2634,3485,Withdrawal,3692.93,09/16/24,Project century seem happen.
2635,3205,Withdrawal,3419.42,09/28/23,Low here record official find four.
2636,3963,Deposit,4774.24,08/15/24,Story kind partner result child force.
2637,2779,Deposit,2955.01,08/12/23,Size interest real trial both card.
2638,3035,Deposit,4981.88,01/08/24,Watch against sport environmental today.
2639,3431,Transfer,4322.38,09/03/23,Window crime sit drug after this.
2640,1528,Transfer,2743.24,09/28/24,Blood lay subject score.
2641,1614,Deposit,2681.75,10/29/23,For on goal national.
2642,4339,Withdrawal,2086.34,06/11/24,Drop direction return management.
2643,355,Withdrawal,4312.93,04/30/23,Then about radio draw notice rest.
2644,1346,Transfer,857.53,01/27/24,Degree imagine board.
2645,626,Withdrawal,3569.17,10/16/24,Hospital young during speech week despite.
2646,4968,Withdrawal,2627.86,08/25/23,Determine dog whatever.
2647,1993,Transfer,2870.9,03/28/23,Year far not animal but.
2648,1470,Transfer,1716.67,11/07/23,Ability though politics interview thank lot.
2649,1578,Transfer,4906.64,11/04/24,Summer themselves medical.
2650,3648,Deposit,3118.64,01/23/23,Clear century work they let.
2651,1447,Transfer,3751.82,06/05/23,Us dinner join play mouth.
2652,611,Deposit,2753.42,08/21/23,Skill student about door whose wish.
2653,426,Deposit,3014.82,11/14/23,Blood little full reveal test officer.
2654,2367,Transfer,2789.68,05/21/24,Trade important day fish news.
2655,2743,Withdrawal,2854.18,11/12/23,Everyone our former drop.
2656,1341,Deposit,3232.79,07/04/24,Particularly sister from growth.
2657,1465,Transfer,2470.31,10/18/23,Everyone sit table camera recent.
2658,444,Withdrawal,3058.15,12/29/23,Father major site building employee country.
2659,778,Deposit,1201.96,12/22/23,Nothing majority plan under staff.
2660,3107,Withdrawal,2391.74,05/23/23,Professional point study affect industry not.
2661,1381,Deposit,2252.11,12/25/22,Item dream prepare resource market friend.
2662,2881,Withdrawal,1820.36,10/26/24,Finish avoid detail ground eat discussion.
2663,1101,Transfer,1354.64,04/21/24,Top per everyone.
2664,1687,Transfer,845.75,08/10/24,Size pick conference.
2665,4814,Transfer,220.2,09/15/24,Bad if save understand figure.
2666,2433,Transfer,438.57,06/09/24,Far vote believe simply true address.
2667,4324,Transfer,2874.24,08/09/23,Blood tree show car go response.
2668,3161,Withdrawal,3584.9,05/16/23,Hand least woman up.
2669,1092,Transfer,1179.47,02/04/23,Couple buy color fall race.
2670,4815,Deposit,1598.83,03/09/23,Book you blue involve everything last.
2671,665,Transfer,3180.76,05/13/23,Me audience contain series note sell.
2672,2817,Deposit,176.47,01/29/24,Southern way read future animal.
2673,4992,Withdrawal,2033.28,01/29/24,Enter of firm program nearly activity.
2674,1042,Withdrawal,1209.48,05/20/24,Anyone note live.
2675,2119,Withdrawal,2215.27,02/02/24,Office computer federal structure anyone order.
2676,3398,Withdrawal,342,03/20/24,Most one together miss still let.
2677,2136,Transfer,3205.95,12/02/23,Picture college benefit have factor.
2678,4906,Transfer,4157.8,09/10/24,Why close present news expert painting.
2679,3444,Deposit,3876.04,05/13/24,Artist five decision reflect.
2680,1599,Withdrawal,3496.81,05/04/23,Anyone affect threat meet manage include.
2681,2832,Deposit,885.57,08/04/23,Work job bag water smile.
2682,1637,Deposit,1742.09,12/10/22,Serious true add him glass.
2683,388,Withdrawal,1067.6,03/10/24,Throughout next course.
2684,2694,Transfer,2820.99,06/08/24,Arm chance thought sea future along.
2685,2071,Deposit,1036.32,10/07/23,Much marriage message.
2686,1790,Withdrawal,1740.35,07/04/24,Realize and want story.
2687,2757,Transfer,3942.11,05/31/24,Business less conference sit citizen us.
2688,995,Transfer,2559.41,08/26/23,Develop site notice decision east career.
2689,3688,Transfer,4960.76,08/09/23,Herself recognize response there.
2690,43,Deposit,3381.12,07/03/24,Road it day project.
2691,791,Transfer,4066.42,09/24/23,Wrong station mission institution his exist.
2692,1495,Transfer,3252.96,04/18/24,After door argue plan back.
2693,3618,Transfer,3859.67,06/07/23,Involve reveal mention wonder.
2694,1991,Deposit,2526.42,11/04/24,Build understand character audience.
2695,1497,Withdrawal,2674.74,05/12/23,Certain main maintain successful above.
2696,2792,Deposit,4020.76,11/07/23,Surface group official.
2697,4915,Withdrawal,1954.91,08/17/24,Impact play class.
2698,850,Withdrawal,2003.57,08/14/23,Thus speech health.
2699,1809,Transfer,4447.15,04/23/23,Experience itself after own.
2700,4186,Withdrawal,15.93,06/02/23,Sing deep big.
2701,3016,Withdrawal,3829.15,02/06/23,Certainly financial certainly agent.
2702,4043,Deposit,3746.98,10/25/24,Stock sing attack into ball.
2703,2129,Withdrawal,1318.08,01/02/24,Image very across firm.
2704,1230,Deposit,3289.18,12/14/22,Prevent think crime.
2705,4110,Deposit,2899.02,12/21/23,Whom huge although necessary.
2706,3785,Withdrawal,3643.56,03/06/23,Mean he avoid.
2707,415,Transfer,4932.11,08/13/24,Reason agent either.
2708,4375,Transfer,481.1,10/04/24,Tell thought place test skill.
2709,4770,Deposit,3286.56,02/08/23,Specific year source.
2710,3620,Transfer,4860.47,10/26/23,Current add shoulder child central.
2711,4319,Transfer,1353.65,06/27/24,Cost operation deep role thousand.
2712,3145,Withdrawal,4140.58,02/24/24,Street research head.
2713,1509,Withdrawal,3501.62,02/01/23,Company bad have kind.
2714,4292,Transfer,1343.61,03/02/24,Piece focus car relate model east.
2715,3274,Transfer,3543.78,03/14/23,Store middle station camera television.
2716,3046,Withdrawal,2992.33,11/18/23,Stop key same all something herself.
2717,873,Deposit,2906.81,08/29/24,Family model thing.
2718,4917,Withdrawal,3854.03,02/16/23,Adult surface rest cover across Mr.
2719,55,Withdrawal,2134.97,12/29/23,Mr ten take wear.
2720,4505,Withdrawal,1397.94,08/17/24,Behavior team little list key.
2721,3498,Transfer,4952.14,08/16/23,Mrs possible others sign section.
2722,78,Deposit,3876.38,11/28/24,With guess religious those.
2723,3301,Deposit,3124.54,01/21/24,Senior safe religious meet American want.
2724,1203,Transfer,1827.95,01/19/23,Including century white local.
2725,2858,Deposit,3670.71,10/02/24,Always that social.
2726,115,Withdrawal,2629.88,06/28/24,Within sing thought sport.
2727,4928,Withdrawal,4823.42,03/22/23,It although imagine brother.
2728,3808,Transfer,277.03,02/02/23,Number whole stage week ask medical.
2729,1419,Transfer,3284.22,04/18/24,Recent beat get.
2730,4860,Withdrawal,1851.41,03/02/23,A exist speech.
2731,1596,Withdrawal,3524.64,02/14/23,A stop song.
2732,2050,Deposit,4828.53,03/06/24,Growth subject skin.
2733,3895,Deposit,506.32,11/13/24,Figure by present officer at.
2734,899,Deposit,3792.12,08/31/24,Most among season position nothing over.
2735,1121,Deposit,3685.46,07/28/23,Question picture thousand decade scientist throw.
2736,2323,Withdrawal,3367.75,06/19/24,Finish economic call today culture.
2737,2066,Withdrawal,2716.18,03/29/24,Most over he for.
2738,4514,Transfer,231.12,04/02/23,Bad add respond here.
2739,3555,Withdrawal,4822.75,08/12/23,Forward behind when minute.
2740,163,Deposit,1590.57,06/21/23,Our can project determine term concern.
2741,674,Deposit,3525.73,03/14/23,Quality top this room.
2742,2584,Deposit,1614.04,08/03/23,Strong point why series Mr with.
2743,4114,Transfer,2524.69,04/23/23,Attorney base probably.
2744,1268,Withdrawal,3035.48,09/10/23,Try a reach administration minute.
2745,3384,Withdrawal,3307.32,10/19/23,Piece impact agree young ever including.
2746,2797,Deposit,2487.38,01/04/24,Democrat course although person.
2747,4295,Transfer,376.79,10/20/24,From represent include environmental pull own.
2748,2067,Transfer,3840.64,03/17/23,Tell detail personal artist want not.
2749,3127,Transfer,4769.92,09/23/23,Determine technology exist night.
2750,2468,Deposit,1082.81,07/17/24,Most remember film young difficult billion report.
2751,1476,Transfer,1393.1,06/21/24,Interview training such key.
