Transaction_id,Account_id,Transaction_type,Amount,Transaction_date,Description
7442,3605,Deposit,3340.05,07/19/23,Sign same inside guy.
7443,2831,Withdrawal,1854.78,03/24/24,Radio play long theory popular reflect.
7444,3781,Withdrawal,105.03,08/08/24,Behind subject sell.
7445,3692,Withdrawal,4104.84,10/25/24,Behavior popular piece project news every.
7446,3003,Deposit,95.02,05/03/24,Religious produce director between argue.
7447,33,Deposit,2828.84,07/19/24,Many finally action go suffer.
7448,1284,Deposit,1197.08,07/08/23,Apply both and sure.
7449,4720,Withdrawal,2749.2,02/14/23,War seem officer.
7450,780,Withdrawal,3618.74,05/17/23,Guess hot perhaps add section.
7451,704,Transfer,2096.19,06/17/24,Hour production act money morning.
7452,4360,Transfer,1493.09,09/11/23,Ok discuss produce eat heavy.
7453,3791,Withdrawal,1772.66,02/11/24,It allow other role their forget.
7454,3076,Withdrawal,3636.74,06/10/23,Program dark ability difference product.
7455,692,Transfer,113.66,08/17/23,Happy finish law.
7456,2867,Deposit,4256.86,10/10/23,Eat just loss.
7457,3819,Deposit,867.75,01/06/23,What base control heart near summer.
7458,3592,Deposit,3469.85,04/27/23,Sell from enough media important.
7459,371,Transfer,2222.71,05/01/24,Sea citizen mouth discuss avoid.
7460,1111,Transfer,1741.02,02/05/24,Course face bit beautiful now.
7461,754,Withdrawal,3404.14,06/24/24,Check report Congress reason affect fast.
7462,3463,Transfer,4115.17,04/05/23,Oil gas or hot.
7463,1194,Transfer,4546.34,07/17/23,Again suddenly happen speech gun professional.
7464,1170,Withdrawal,2826.83,11/10/23,Heavy course democratic west today.
7465,3641,Transfer,2708.81,01/17/24,Big animal nothing fact.
7466,556,Deposit,155.62,08/24/23,Increase really do act see voice.
7467,2485,Withdrawal,1958.73,02/19/24,Of what new couple man five.
7468,409,Transfer,1443.54,02/26/23,Source building interview add.
7469,1907,Withdrawal,2046.61,07/28/24,Decade church until fall.
7470,1416,Withdrawal,4546.08,12/30/22,Push after want what authority.
7471,2086,Deposit,1564.26,07/14/23,Along class kid three kitchen.
7472,1350,Withdrawal,2327.71,09/03/24,Read sport heavy now personal again.
7473,2803,Withdrawal,4550.22,06/23/24,Attack board just.
7474,2599,Transfer,1785.08,04/04/24,Everybody nature late speech else turn.
7475,4669,Withdrawal,1561.29,10/20/24,Doctor truth threat try fund.
7476,1637,Withdrawal,4640.44,11/20/23,Rest study model back.
7477,2870,Deposit,2382.52,07/12/23,Close response individual describe husband live.
7478,4996,Withdrawal,2886.13,06/15/23,Last short big concern.
7479,1730,Transfer,705.64,05/22/23,Or maintain policy.
7480,2065,Deposit,2678.31,06/16/23,Smile me very present organization argue.
7481,2874,Withdrawal,4846.19,11/07/23,Edge note side.
7482,4760,Transfer,3709.02,11/06/24,Resource them open various window.
7483,3274,Deposit,3135.89,07/01/24,Not listen system.
7484,3332,Transfer,3789.45,05/25/23,Become question stage very.
7485,2606,Transfer,3624.94,04/15/23,Yourself challenge minute want relate next.
7486,4152,Deposit,1792.75,11/09/23,Behind position who anyone.
7487,3879,Transfer,1998.23,04/26/23,Now cold style.
7488,3335,Withdrawal,1404.64,05/09/23,Maintain administration military people.
7489,1269,Deposit,21.95,12/07/22,Help wonder go meet same billion.
7490,496,Withdrawal,3306.05,06/04/24,Evening whose they western job tree.
7491,2123,Deposit,1941.28,11/10/24,Term next knowledge charge thousand cost.
7492,4298,Withdrawal,2955.98,09/14/23,New thing will more hit.
7493,1530,Withdrawal,4035.96,02/10/23,Cold here party similar animal plant.
7494,3689,Deposit,1158.72,06/10/24,Spend act artist compare his.
7495,4371,Withdrawal,2103.4,05/19/24,Difficult Democrat write.
7496,4323,Deposit,137.8,04/16/23,Imagine scene kind professional arrive.
7497,540,Withdrawal,4539.69,12/26/23,Member enjoy physical arrive carry.
7498,3652,Transfer,1862.02,04/24/24,Himself star teach hot room.
7499,3839,Deposit,2137.99,06/07/24,Visit statement certainly.
7500,2189,Withdrawal,3233.55,07/11/23,Agreement which entire top worry none.
7501,2226,Transfer,2636.01,12/27/23,Especially strategy drive likely true each.
7502,2514,Withdrawal,2650.92,04/22/23,Foot Democrat only production.
7503,85,Withdrawal,4796.18,09/27/24,Bring under happen consider night.
7504,721,Transfer,133.37,08/26/23,Peace individual notice dog big.
7505,823,Deposit,4558.78,07/19/24,Compare long easy trouble past manager.
7506,2012,Withdrawal,455.53,04/18/24,Score behavior guy culture.
7507,2090,Withdrawal,414.64,09/30/23,Spring can Democrat paper.
7508,1960,Transfer,3227.31,04/07/23,Subject opportunity low bank.
7509,4586,Deposit,3300.17,09/06/23,Traditional social note.
7510,3713,Transfer,4580.58,10/09/24,Present list indeed phone within.
7511,2022,Withdrawal,1518.88,04/16/24,Cut coach serve court.
7512,230,Transfer,4780.13,08/07/23,Drug east speak.
7513,1901,Withdrawal,963.62,11/27/24,Because material mother enough common.
7514,4964,Deposit,3905.03,07/03/24,Particular anyone ever give modern.
7515,545,Withdrawal,2059.3,10/14/23,Eat report phone.
7516,4638,Deposit,4981.39,05/11/24,Instead into news trial couple low.
7517,3067,Transfer,4448.42,06/13/23,Enter air debate movement nation boy.
7518,2388,Deposit,503.94,06/03/23,Mr floor decade least.
7519,390,Transfer,3429.23,02/11/23,Western daughter health painting maintain.
7520,1152,Withdrawal,2089.72,06/23/23,Great degree music.
7521,977,Deposit,4189.18,07/08/24,Election possible happen approach loss.
7522,3228,Deposit,1124.02,11/09/24,Party least general discuss.
7523,4981,Withdrawal,3576.34,08/31/23,Political half politics score.
7524,1524,Deposit,64.65,07/11/24,Message break direction own Mrs wall.
7525,2018,Withdrawal,4933.25,04/14/24,Point voice example thought.
7526,422,Deposit,4276.91,08/29/23,End dark improve then color.
7527,1473,Deposit,3248.56,01/01/24,Somebody he way.
7528,4043,Transfer,893.22,11/11/24,Someone guy both skill imagine.
7529,3550,Deposit,2568.41,04/28/23,Remember beyond eight gas.
7530,1915,Withdrawal,1334.58,05/28/24,Establish character city.
7531,1199,Transfer,4318.6,01/22/23,Term technology make call.
7532,4104,Transfer,1285.55,10/19/24,Next out both.
7533,4656,Deposit,3276.75,07/11/23,Indicate prove air.
7534,324,Deposit,4177.54,06/28/24,Concern they down piece among official cost.
7535,3679,Deposit,4757.05,04/26/23,Call mother our current.
7536,730,Transfer,3384.51,05/14/23,My PM case.
7537,897,Withdrawal,3227.76,02/07/23,Oil focus lose Republican pressure.
7538,1065,Withdrawal,4000.64,02/01/23,Teach show spring these whom.
7539,717,Transfer,557.73,10/14/23,Partner wrong between other toward personal.
7540,3440,Withdrawal,2153.9,04/29/24,Next almost him build.
7541,2518,Transfer,2390.84,12/09/22,Agency yourself carry marriage behind.
7542,1794,Deposit,3774.17,09/15/23,Drug consider end color practice.
7543,3460,Transfer,331.77,12/01/23,Democratic move worker character behavior.
7544,3568,Withdrawal,2736.64,05/23/23,Exist scene model.
7545,4578,Withdrawal,1659.47,01/26/23,Note sell risk during far but.
7546,2513,Transfer,2012.39,06/26/23,Suffer knowledge participant home finally could.
7547,2588,Withdrawal,1291.93,03/04/23,Since until success significant.
7548,140,Deposit,1128.78,07/02/23,Natural animal and magazine get military.
7549,4709,Deposit,4743.25,05/03/23,Manage central family human attention.
7550,993,Withdrawal,4014.83,02/09/23,Actually customer know.
7551,3998,Withdrawal,1345.2,11/14/23,Fall loss eight.
7552,3918,Withdrawal,1506.08,11/23/24,Forget finish month store.
7553,2189,Deposit,1478.91,08/08/24,Fact age sign agent fill identify pick.
7554,1472,Withdrawal,529.21,08/11/23,Free drug game necessary author join.
7555,3498,Deposit,3523.07,02/21/24,Wait month discover campaign cut.
7556,39,Deposit,2727.15,05/29/23,Conference same support.
7557,4087,Transfer,2935.54,07/11/24,Box training similar.
7558,2690,Deposit,4682.39,09/29/24,Thought box store consider each.
7559,3577,Withdrawal,2433.75,01/11/24,Scene will mouth themselves.
7560,4309,Deposit,4291.8,01/05/24,Painting must education fact.
7561,3580,Deposit,2859.01,11/21/24,South save certainly above.
7562,878,Withdrawal,184.99,06/16/24,Long another who rate.
7563,3253,Transfer,760.14,02/15/23,Decade hospital your.
7564,1323,Transfer,1444.76,06/17/23,Water article month cup ahead talk.
7565,1325,Transfer,4411.15,06/19/23,Reason scientist as.
7566,4776,Deposit,968.56,08/25/24,Goal only take brother employee.
7567,2150,Deposit,1163.41,11/14/23,Four arrive voice service society.
7568,3019,Deposit,244.32,05/03/24,Market company feeling.
7569,3313,Deposit,1327.6,07/25/24,Rest board drug.
7570,3169,Transfer,1012.01,02/03/23,Strong factor his team idea actually.
7571,1400,Withdrawal,2761.37,03/04/23,Hundred good among fish character.
7572,3778,Deposit,20.14,02/18/24,Compare artist century.
7573,444,Withdrawal,721.83,07/22/24,Bill either happy mean.
7574,4322,Withdrawal,1045.23,04/25/23,Local entire sport can describe.
7575,2121,Transfer,3720.88,10/24/24,Technology rest even.
7576,4167,Withdrawal,2591.61,07/13/23,Soldier old way.
7577,980,Deposit,2723.47,10/10/23,Prepare single walk main wall style available.
7578,3785,Deposit,2213.21,02/26/24,Base heart house itself theory character.
7579,210,Withdrawal,4389.21,09/13/24,Hold health as exist.
7580,603,Withdrawal,232.42,10/25/24,Identify tree ball want democratic computer.
7581,4144,Withdrawal,1156.06,11/18/24,Business rock their operation black.
7582,3544,Withdrawal,2296.63,04/25/24,Drug nothing yes become.
7583,4303,Deposit,3091.44,06/10/24,Camera several despite school stand.
7584,133,Withdrawal,2984.01,05/08/24,Agree onto modern also piece.
7585,2075,Withdrawal,4968.85,05/27/23,Enter candidate figure letter all friend.
7586,1770,Withdrawal,2594.65,04/23/23,Allow yourself memory.
7587,2268,Withdrawal,1156.75,06/04/23,Notice language audience energy.
7588,559,Withdrawal,3728.08,02/09/23,Image others instead should.
7589,3622,Deposit,3623.59,12/19/22,Hand factor century simply least.
7590,174,Withdrawal,1701.14,08/16/23,Risk policy material.
7591,283,Withdrawal,4446.39,04/27/23,Always defense senior she.
7592,4957,Withdrawal,4614.56,02/04/23,Discuss rather maybe mother record.
7593,609,Deposit,4040.86,10/09/24,Color success sister.
7594,2547,Transfer,459.91,08/28/23,How type cut almost.
7595,3477,Withdrawal,2757.75,11/10/23,Do remain garden without research employee.
7596,4004,Deposit,1028.1,12/08/23,Should join morning.
7597,2410,Transfer,3933.23,11/09/23,Up professional every future sit region.
7598,292,Withdrawal,2105.64,12/18/23,Value agency discover short.
7599,929,Transfer,2743.03,04/04/24,Never election part half reveal.
7600,3188,Withdrawal,1073.22,05/10/23,Base next although.
7601,2233,Transfer,4874.7,02/28/24,Prevent writer security evidence though.
7602,2041,Withdrawal,1706.07,03/09/24,Reduce land almost school people again.
7603,169,Deposit,1634.71,09/27/24,Adult stage audience leg.
7604,1267,Transfer,2034.69,01/23/24,Little program project career.
7605,1324,Withdrawal,3055.49,11/11/24,Activity rest father her industry year.
7606,4202,Transfer,4632.61,04/30/24,Kind ago market capital.
7607,1491,Deposit,2867.83,09/05/24,Education admit allow.
7608,3626,Deposit,4627.75,01/31/23,Near whether avoid practice.
7609,905,Transfer,2408.82,07/25/24,Any detail raise role.
7610,2596,Deposit,1303.25,12/26/23,Standard girl main health worry.
7611,1790,Withdrawal,3108.12,06/30/24,Beyond foreign still read.
7612,3925,Withdrawal,3239.48,08/03/24,Over court identify hospital whether our.
7613,4009,Withdrawal,2002.82,12/12/22,Anyone development spend hit food.
7614,2907,Transfer,3072.34,10/23/24,Worker notice generation.
7615,3155,Deposit,2597.47,11/06/23,Soldier increase law.
7616,4710,Transfer,4533.59,12/15/22,Figure edge rock resource main sit.
7617,3454,Deposit,17.75,04/18/24,Successful report require reality.
7618,624,Transfer,3888.52,09/17/23,Voice wife require white.
7619,417,Deposit,2878.58,03/20/23,Good speak reduce herself.
7620,2812,Transfer,2678.77,01/06/24,Nor because real analysis.
7621,3717,Deposit,1624.59,08/27/24,Development vote a.
7622,1417,Deposit,224.87,02/13/24,Born anything or magazine answer something.
7623,2246,Withdrawal,184.71,05/11/23,Them company doctor teach model.
7624,3781,Deposit,1482.68,01/05/24,Edge choice which daughter.
7625,2454,Deposit,3870.59,11/21/24,Others great protect.
7626,4124,Transfer,1779.24,02/08/23,News by serious.
7627,1235,Withdrawal,4256.65,05/13/23,Physical off price help.
7628,4803,Withdrawal,3926.56,06/08/23,Pattern condition decade personal nearly.
7629,498,Transfer,1464.59,06/16/24,Bed must serve provide defense table.
7630,4799,Transfer,4276.62,06/11/24,There civil accept allow again field.
7631,4382,Transfer,4839.54,09/03/24,Pressure throw read similar course.
7632,2706,Deposit,2690.79,03/04/24,Student road look recent level behavior.
7633,3866,Withdrawal,996.98,07/13/23,Early less discussion and final later.
7634,538,Withdrawal,4751.74,06/08/23,Ten never necessary walk than.
7635,3604,Withdrawal,4689.65,07/03/23,Third wife mean structure.
7636,1691,Deposit,4354.53,04/25/24,Radio evidence at throw course career.
7637,739,Transfer,2812.23,09/21/23,All color recognize follow.
7638,2252,Deposit,55.06,09/23/23,Consider decision three scene.
7639,2453,Withdrawal,4785.48,10/31/23,Fly which establish yes.
7640,3213,Transfer,694.27,11/19/24,Nature Republican give would help sell.
7641,4002,Deposit,2954.64,10/18/23,Firm shoulder specific meet card.
7642,4583,Transfer,832.1,12/24/22,Begin central kind.
7643,3871,Transfer,646.54,06/28/24,White well try try design news open.
7644,926,Deposit,3046.79,10/21/23,Common me attorney.
7645,1655,Transfer,3911.26,10/30/24,Drive customer buy current strong high.
7646,4948,Transfer,1428.21,05/02/24,Hand not fish figure history.
7647,1693,Withdrawal,4382.88,05/04/24,Citizen usually newspaper with.
7648,4493,Deposit,2110.58,01/23/24,Paper improve interest project particularly drop.
7649,4896,Withdrawal,4484.34,07/13/23,Option never wear main nearly.
7650,4288,Withdrawal,4278.81,05/02/24,Cost ago turn.
7651,656,Transfer,1046.83,07/15/23,Throughout public scientist stop ground.
7652,4166,Withdrawal,3057.45,07/29/23,Officer indeed sit himself fight wrong.
7653,842,Transfer,2792.94,08/09/23,Deep treat easy see.
7654,2881,Withdrawal,4201.05,12/23/23,Attack thing run Republican office.
7655,4931,Withdrawal,1637.46,06/23/23,Business college nation subject.
7656,2923,Deposit,1546.84,12/05/22,Arm military office.
7657,4007,Withdrawal,1378.41,12/02/23,Exactly employee current continue.
7658,4525,Transfer,2476.92,05/01/24,Form life recognize six response policy.
7659,2383,Deposit,3074.15,10/07/24,Story especially court article.
7660,4791,Withdrawal,844.68,06/30/24,Them national we friend.
7661,675,Withdrawal,2242.88,07/01/23,Meet media wind represent.
7662,456,Deposit,1594.14,07/25/23,Rather race poor political.
7663,3634,Deposit,2642.62,04/14/23,Build its cell.
7664,3395,Withdrawal,4823.48,04/28/24,Manage structure ten change.
7665,3262,Transfer,912.74,10/14/23,Stuff stand outside economy address south.
7666,4948,Withdrawal,247.66,04/02/24,Walk to reflect before eight.
7667,4415,Transfer,2519.68,08/25/23,Professional keep care may.
7668,1154,Deposit,215.27,09/25/23,A enough summer major development effect.
7669,505,Transfer,2355.58,02/21/23,Age nature source.
7670,210,Transfer,4917.86,02/16/24,Street front enjoy everything she.
7671,2162,Transfer,2662.87,09/18/23,Scientist debate magazine.
7672,1627,Transfer,591.94,03/28/24,Individual body camera everyone civil perhaps.
7673,4445,Deposit,434.71,01/03/23,These heavy chair course.
7674,2372,Transfer,4576.62,03/18/24,Money member fly likely true.
7675,3403,Transfer,2792.56,02/10/24,Seat hit east morning position television.
7676,3322,Deposit,2835.85,01/22/23,True option doctor hotel despite.
7677,1783,Deposit,1210.43,11/19/24,Write down investment view start class.
7678,4511,Deposit,4588.11,03/28/23,Consider live none.
7679,1825,Transfer,2800.92,09/10/23,Than only officer effect answer.
7680,4361,Deposit,3644.66,07/06/23,Message across break spring.
7681,4679,Transfer,4381.19,10/07/23,Draw you social.
7682,607,Deposit,368.25,05/10/24,Can show region along size suffer.
7683,3498,Deposit,4904.85,07/01/23,Ball statement according.
7684,3004,Transfer,3593.22,09/12/23,Bank add get.
7685,255,Deposit,3956.43,05/04/23,Your plan young.
7686,1411,Transfer,2504.19,11/11/23,They lawyer account action.
7687,3583,Deposit,1116.53,07/29/24,Serve physical condition.
7688,4182,Deposit,4528.78,08/07/23,Customer else big maintain.
7689,4980,Withdrawal,927.06,05/22/24,Determine budget institution become husband.
7690,711,Transfer,4863.82,10/09/23,Amount when action system.
7691,4066,Deposit,4837.92,05/24/23,Left when face star only.
7692,2880,Deposit,4796.28,09/01/24,Site town scientist.
7693,3794,Transfer,3494.03,10/04/24,Too interest phone.
7694,1081,Deposit,2068.2,03/15/23,Order simple away check my treat.
7695,818,Transfer,2141.25,05/10/24,Throughout drop city can increase.
7696,3277,Transfer,3823.95,10/04/24,Try whatever home sit as public.
7697,764,Transfer,1162.98,11/06/23,Worry turn town.
7698,2510,Transfer,2734.54,01/16/23,Two nation tough.
7699,673,Withdrawal,2355.23,06/24/24,Specific step left Mr force past.
7700,1729,Transfer,4261.74,04/13/23,Lead bad before fund.
7701,3267,Withdrawal,4126.72,07/08/23,Authority board economy.
7702,269,Withdrawal,4350.55,08/02/23,Which loss car.
7703,3075,Withdrawal,4422.27,02/11/24,Shake use manager character structure.
7704,499,Deposit,3316.11,03/30/23,Figure baby fund dark them.
7705,1408,Transfer,1701.31,06/23/24,Leader Mrs form eat store.
7706,2062,Transfer,354.47,07/15/24,Long step change government.
7707,153,Withdrawal,698.18,01/31/24,Data wonder plant one cell.
7708,3568,Withdrawal,821.44,08/05/23,Few left necessary matter laugh.
7709,3641,Deposit,1814.11,08/13/24,Rate might skill discuss.
7710,1115,Withdrawal,2895.76,12/09/22,Car forget degree responsibility food.
7711,4545,Withdrawal,402.78,11/19/23,Which area ready protect eight car.
7712,4663,Withdrawal,1936.39,12/17/23,Page respond why husband none.
7713,1131,Withdrawal,3771.24,07/13/23,Sit price want receive respond close.
7714,2636,Withdrawal,3623.46,04/21/24,Few rich page up staff.
7715,4475,Transfer,690.61,12/29/23,Company standard brother indicate.
7716,4870,Transfer,1633.94,01/10/23,Catch business or sister lead.
7717,1771,Transfer,4246.06,08/08/24,Administration size no no why.
7718,4395,Deposit,3901.74,03/30/23,Stage accept note appear center true.
7719,2223,Deposit,3819.35,11/11/24,Everyone offer within couple voice magazine.
7720,3098,Withdrawal,1611.01,08/04/23,Then color word report son.
7721,1276,Transfer,4417.97,05/31/23,Have a effort senior tree.
7722,199,Withdrawal,738.42,06/08/24,Official campaign age.
7723,3646,Transfer,3726.22,04/17/24,Bad certain stand collection.
7724,48,Deposit,4297.4,04/08/24,Hand follow anyone street but.
7725,762,Deposit,1659.93,02/17/24,Fund strategy let Democrat.
7726,3850,Deposit,2319.03,07/14/24,Step discussion school.
7727,4635,Deposit,3632.3,07/22/23,Able reach share place difference.
7728,2727,Withdrawal,4051.05,07/02/23,Nor tree often boy.
7729,4051,Transfer,1389.05,11/09/24,Note soldier know chance enjoy item.
7730,162,Deposit,3097.49,01/07/24,Clearly forget fill.
7731,838,Deposit,1568.35,09/07/23,Will good former throw.
7732,3584,Deposit,3900.51,09/07/23,Certain exist citizen person class record.
7733,628,Transfer,3213.79,04/20/24,War start upon half.
7734,4131,Deposit,1068.08,07/21/23,Here approach run table poor.
7735,1788,Transfer,1680.19,10/27/23,Interest heart all.
7736,421,Withdrawal,3534.02,09/11/24,Thank per church.
7737,772,Transfer,2265.96,05/06/24,Sort one worker always major.
7738,4194,Withdrawal,4804.88,08/28/23,Including add when recent college price.
7739,2097,Transfer,2019.5,07/09/24,Great there develop old myself only.
7740,3746,Deposit,4063.18,08/19/23,Effect visit trade place book.
7741,4552,Transfer,524.76,05/09/23,Risk career wide visit first local.
7742,3628,Transfer,3095,11/27/23,Career must executive on.
7743,4851,Deposit,661.66,07/31/23,Major fall participant bank.
7744,76,Deposit,949.2,10/26/24,Sell write political policy.
7745,3865,Withdrawal,1789.9,08/15/23,Ever employee already listen time.
7746,4336,Withdrawal,2992.85,01/14/23,Physical behavior shoulder.
7747,2900,Withdrawal,3728.7,01/16/24,Republican great baby world.
7748,1836,Transfer,2271.59,08/06/24,Imagine her phone agency rich.
7749,902,Deposit,397.99,06/24/24,Fill create purpose money.
7750,899,Deposit,4698.85,02/18/23,Church catch father maintain.
7751,2853,Transfer,338.87,12/22/23,Two race choose bag tend.
7752,4310,Withdrawal,4670.61,04/14/24,Sing look never man same.
7753,378,Transfer,4134.46,09/18/24,Doctor generation health family who.
7754,1868,Deposit,1515.44,01/03/23,First pull without husband.
7755,2752,Withdrawal,850.77,07/16/24,Machine scene approach than.
7756,818,Transfer,68.2,05/23/24,Simple example population player whatever.
7757,1814,Withdrawal,1300.62,02/05/23,Mention worker piece.
7758,498,Deposit,2048.71,04/27/23,First they prove religious structure employee.
7759,2484,Deposit,3051.88,02/29/24,Policy development question.
7760,4308,Transfer,1640.66,08/16/24,Or skill model if.
7761,2322,Transfer,4541.57,04/17/24,Way maybe mother change field goal.
7762,1226,Transfer,3909.33,11/12/23,Five concern wind class.
7763,2118,Withdrawal,4880.71,04/04/24,Explain chair list nice.
7764,3143,Deposit,4695.07,09/25/24,Technology glass national that.
7765,4544,Transfer,4331.94,02/10/23,Perhaps fight want budget speech citizen.
7766,4911,Transfer,2129.74,11/28/24,See color ball exist affect.
7767,3986,Transfer,317.76,07/01/24,Keep beautiful prevent sister.
7768,97,Withdrawal,3806.82,12/18/22,Change coach concern heavy.
7769,2358,Withdrawal,3520.03,06/01/24,Pick avoid wish bag.
7770,799,Deposit,4874.43,12/18/22,Modern far end reflect dog.
7771,2300,Transfer,4098.92,12/07/23,Feel newspaper start.
7772,1523,Deposit,2408.4,07/20/24,Movement yeah goal society media.
7773,2623,Withdrawal,698.69,06/22/23,Who charge church recognize.
7774,494,Transfer,4700.26,04/10/23,Recently father build agreement camera college.
7775,4064,Deposit,2632.22,09/16/23,Decision local speak serious fill.
7776,4099,Withdrawal,4509.48,02/29/24,More up budget.
7777,2449,Deposit,290.89,05/04/24,Enjoy PM activity.
7778,4186,Deposit,893.11,02/07/24,Market you game able.
7779,4564,Withdrawal,3173.59,02/22/24,Happy recent certain suddenly keep receive.
7780,607,Withdrawal,2515.58,01/04/24,Morning manager always look might project.
7781,3084,Transfer,253.2,12/23/23,Modern ten blue figure hand report.
7782,1782,Transfer,3722.18,01/13/23,Style suggest recognize choice laugh.
7783,3236,Transfer,888.97,07/29/24,Perhaps drop forward.
7784,1584,Withdrawal,20.51,05/31/24,Onto leg want.
7785,1034,Withdrawal,1402.66,12/24/22,Personal little focus room.
7786,3132,Transfer,4743.27,07/28/23,According ago audience into statement.
7787,1930,Withdrawal,1951.98,04/17/24,Growth ahead weight middle.
7788,2263,Deposit,4033.31,07/25/23,Else will be west.
7789,4334,Transfer,449.52,11/18/24,Until go middle occur job music.
7790,3339,Transfer,718.12,03/22/23,Heart walk do newspaper.
7791,2494,Withdrawal,1964.34,02/23/23,Rather Democrat again point.
7792,2688,Withdrawal,4407.48,08/18/23,Make effect for nature allow whose.
7793,1358,Withdrawal,1064.19,10/25/23,Learn behavior paper.
7794,3705,Transfer,2712.53,03/19/24,Voice quality thing more nation rest.
7795,2972,Withdrawal,4156.27,08/09/23,Common it hair high.
7796,3509,Deposit,18.85,11/17/24,Drug create game.
7797,1850,Withdrawal,1522.36,10/15/24,Consumer station major admit him big.
7798,2201,Withdrawal,4892.75,09/27/24,Challenge tend pattern last always.
7799,862,Transfer,4599.56,12/31/23,Body article worry program matter.
7800,1094,Transfer,2986.72,11/29/23,Family finish sit.
7801,4140,Transfer,2073.48,10/28/24,Class well lose.
7802,2691,Deposit,1320.24,10/10/24,Without almost beyond.
7803,3592,Deposit,4714.48,09/25/24,Bed election development.
7804,2085,Transfer,4353.97,06/21/24,Because practice general difference benefit.
7805,4684,Deposit,3569.51,12/07/23,History smile camera wish since record.
7806,1136,Withdrawal,3869.24,06/10/24,Strategy wonder scene fly always.
7807,2084,Transfer,1665.13,10/06/24,Foot measure Mr.
7808,426,Transfer,1164.47,07/24/23,Recently second life film practice present.
7809,1334,Withdrawal,4952.35,10/15/24,Police important recent movement threat three.
7810,2750,Deposit,683.95,07/28/23,Machine oil give hit.
7811,433,Withdrawal,179,08/14/23,We your event list likely program.
7812,42,Transfer,2289.17,09/20/24,Perhaps enough economy.
7813,817,Withdrawal,1198.54,04/11/23,Concern social owner move.
7814,2430,Transfer,4465.7,01/04/24,Over difficult newspaper low follow activity.
7815,4656,Transfer,1313.99,10/24/23,Guy yet investment technology.
7816,1721,Deposit,762.32,01/22/23,Whose control reduce behind pretty time special.
7817,3947,Transfer,3794.56,08/14/24,Opportunity kid stock.
7818,2214,Deposit,3920.98,05/25/24,Unit note but generation thing carry.
7819,3244,Transfer,27.21,11/23/24,Firm sure since parent this reveal.
7820,1175,Withdrawal,3001.79,12/27/22,Authority somebody thank two.
7821,1912,Transfer,2633.25,07/12/24,Product along candidate someone key hope.
7822,3349,Transfer,1661.39,11/12/23,According send same however question.
7823,346,Deposit,3969.29,02/02/24,Brother feel great society.
7824,3378,Transfer,4619.22,07/12/24,Congress big cold may wide.
7825,2185,Deposit,2402.88,07/14/23,Including low necessary compare pay different.
7826,15,Withdrawal,4629.1,02/01/24,Heart decade military idea dark.
7827,3149,Transfer,2885.02,12/14/22,Peace recently specific performance ground.
7828,3387,Withdrawal,4557.34,01/21/24,Prove fund physical law result.
7829,4955,Deposit,426.12,06/26/24,National participant successful.
7830,1651,Transfer,1003.63,12/22/22,Something writer bit measure.
