Transaction_id,Account_id,Transaction_type,Amount,Transaction_date,Description
1,4638,Transfer,4391.42,01/28/24,Hotel gun but listen.
2,4904,Withdrawal,1731.46,03/17/24,Play have huge without look practice.
3,2870,Withdrawal,2885.38,05/26/23,Any agency cut this.
4,1068,Deposit,895.47,06/22/23,Else other these.
5,4820,Transfer,4412.48,03/03/23,Special Mrs election fill reason measure.
6,4075,Transfer,3326.22,11/10/24,Two money decide.
7,619,Withdrawal,2711.2,04/04/23,Produce threat buy factor number.
8,2328,Deposit,150.31,06/11/24,Behind rock woman dream.
9,2001,Transfer,1026.79,07/01/24,Old soon become and.
10,4019,Deposit,1597.22,08/23/23,Man bed above with economic.
11,397,Deposit,531.87,01/16/24,Of network represent rise.
12,2438,Transfer,3933.3,04/01/23,Visit success toward opportunity around.
13,4398,Withdrawal,2960.01,06/13/24,Spend case under I music.
14,1499,Deposit,766.35,09/19/23,Power paper several you boy.
15,4246,Withdrawal,3123.71,10/01/23,Doctor call dinner cultural force approach.
16,1256,Deposit,2672.23,01/16/24,Especially improve result sense education ground.
17,702,Transfer,1568.17,03/13/24,Three eat positive season foreign ball.
18,1727,Transfer,3608.53,07/27/23,Know pass reduce agent vote.
19,4743,Withdrawal,631.21,06/22/24,Network ten much tough.
20,4341,Withdrawal,2062.35,05/13/23,Attention reality authority happy success sit.
21,3077,Transfer,3888.31,04/14/24,Property thank likely.
22,2592,Transfer,4662.78,08/18/23,Political center certain Democrat.
23,3188,Deposit,475.3,09/25/24,Model someone within near them offer.
24,2811,Withdrawal,3687.2,11/19/24,Really opportunity successful.
25,3601,Deposit,106.87,09/29/24,Everything dark away thus.
26,2519,Transfer,3389.88,02/12/24,Action because alone.
27,1944,Transfer,3430.82,12/13/23,Oil herself kind believe authority brother.
28,1527,Deposit,117.94,03/11/23,Land apply assume according time floor address.
29,2196,Deposit,1977.25,05/19/23,Story writer building article point.
30,902,Deposit,2459.87,01/03/23,House four local practice.
31,1927,Deposit,1042.08,03/09/23,Tough cell election hotel true.
32,3078,Transfer,2350.52,09/09/23,Very community itself standard cold.
33,3539,Transfer,200.8,07/07/24,Five shake remain theory throughout newspaper.
34,4847,Deposit,3388.69,12/27/23,Performance PM statement themselves little eight.
35,4439,Withdrawal,2350.68,06/27/23,Space quickly pretty child guy voice.
36,13,Withdrawal,3952.7,01/07/23,Share end run treat husband.
37,4746,Deposit,4364.22,12/10/23,Best perform in process once doctor.
38,4178,Deposit,2375.39,11/19/23,Little serve name remain much.
39,4709,Deposit,2937.2,05/29/24,Half western food after election stuff.
40,2760,Deposit,1938.66,07/08/23,Form six seem vote issue.
41,61,Withdrawal,816.63,11/19/24,Generation improve of town design team.
42,2693,Transfer,3181.75,06/12/24,Again who degree.
43,4240,Withdrawal,1793.05,05/12/24,Start billion make thought.
44,1247,Withdrawal,1727.64,01/24/23,Beat off doctor.
45,3140,Transfer,4227.91,01/10/23,Peace challenge apply house impact.
46,4727,Deposit,1719.17,03/20/24,Look tough third than carry still.
47,4572,Withdrawal,3409.44,08/08/24,Fear practice source camera.
48,18,Transfer,240.02,05/17/24,Miss entire central manage professor worker.
49,2346,Transfer,202.26,05/22/24,Enjoy show behind.
50,3079,Withdrawal,40.13,08/10/24,Task painting accept entire compare.
51,4578,Transfer,667.33,03/19/24,Someone believe pull.
52,3675,Transfer,880.4,11/11/24,Product life which during.
53,3302,Withdrawal,3651.42,10/11/24,Step simply visit.
54,533,Withdrawal,1007.25,04/17/23,Economy model believe road.
55,325,Withdrawal,3959.27,12/11/23,End reveal into.
56,492,Withdrawal,129.08,12/18/22,Risk bar mean line.
57,2148,Withdrawal,2675.2,01/20/23,Week perhaps heavy president billion great.
58,1137,Deposit,4236.62,08/09/24,Whole happen natural across.
59,3689,Deposit,1466.39,05/21/24,Find born according agent way.
60,1607,Transfer,3124.01,09/03/24,Lose film relationship.
61,4057,Withdrawal,4030.12,07/28/23,Team but reduce.
62,2269,Deposit,3131.15,06/27/24,Present mind particular mention he.
63,1082,Withdrawal,774.13,10/02/24,Cover unit statement between.
64,3553,Withdrawal,3688.84,06/08/24,Raise job management sell who fund.
65,1839,Deposit,1924.21,07/11/24,Staff theory trial baby point wrong.
66,2887,Transfer,4693.63,12/06/22,And activity game.
67,4582,Withdrawal,3351.89,08/08/24,Market street beautiful better toward.
68,1598,Transfer,1209.13,04/12/24,Assume teach case bag.
69,2359,Deposit,1338.92,03/01/24,Unit majority safe happen create source.
70,3127,Withdrawal,1785.76,07/10/24,Stuff car may join.
71,2382,Withdrawal,841.4,10/05/24,My hope color card level either.
72,3895,Transfer,1281.45,12/05/22,Catch nice throughout.
73,314,Withdrawal,2243.4,07/28/23,His around western.
74,1958,Transfer,3813.96,09/12/23,Much daughter down analysis.
75,4169,Withdrawal,4892.22,08/06/23,Us have ok.
76,2788,Transfer,4071.44,05/15/24,Against recent heavy west Congress.
77,2100,Deposit,290.07,10/23/24,Should industry open daughter since.
78,4661,Deposit,2573.67,06/15/23,Hair admit everything account president meeting.
79,4375,Withdrawal,557.06,08/25/24,Issue we development great.
80,4805,Withdrawal,3107,04/29/23,Size form better without.
81,3119,Deposit,3086.16,12/25/23,Pretty attack with.
82,1485,Transfer,3026.93,07/24/23,Out compare resource certainly defense.
83,4704,Deposit,2598,08/16/23,Nor better difficult skill suddenly address.
84,2866,Deposit,4910.21,05/07/24,Its their director.
85,1680,Deposit,4209.13,01/01/24,Color understand claim strategy brother.
86,4101,Deposit,4149.39,02/24/24,Southern upon hospital today.
87,3028,Deposit,4353.89,11/13/23,Its region east type.
88,1409,Withdrawal,1992.14,06/13/23,Book term during per art consumer.
89,1141,Transfer,4196.97,06/09/23,Win easy although month.
90,3197,Deposit,4780.09,09/04/23,Mother wind design eye forget performance.
91,3610,Deposit,1235.24,06/11/23,Friend final there.
92,326,Transfer,3313.76,01/27/23,Without also operation foot gun.
93,2743,Withdrawal,2702.63,07/04/24,Tv change various other.
94,668,Transfer,464.25,09/01/23,Deep small offer choose race.
95,993,Withdrawal,1317.74,05/19/23,Member politics case.
96,4840,Withdrawal,4164.63,09/25/24,Huge figure choose since gas item.
97,3651,Deposit,2695.36,09/19/23,Arm air something current knowledge somebody.
98,1003,Deposit,2007.7,02/05/23,Either party medical environment.
99,3035,Withdrawal,3638.75,10/16/23,Hot weight these.
100,3739,Withdrawal,4626.99,05/22/23,Top have gas.
101,2535,Transfer,906.91,11/10/24,Catch stay take fear.
102,4934,Withdrawal,2253.13,12/30/22,Say thus throughout system voice purpose.
103,4617,Transfer,1350.46,12/15/23,Alone throw computer.
104,1327,Withdrawal,474.57,12/13/22,Meeting suggest friend information.
105,3766,Deposit,3939.47,04/04/24,Your local course especially per know.
106,2803,Transfer,4165.35,11/19/24,Single old him upon floor.
107,2337,Withdrawal,3346.37,02/19/24,Whatever order follow him chair.
108,2429,Deposit,490.93,09/13/24,Color low family fall modern walk.
109,3909,Transfer,4662.33,09/07/24,Money subject raise.
110,2824,Deposit,24.61,08/18/23,Probably stock provide house since mother.
111,1713,Transfer,3436.49,01/22/24,Then career more modern down right.
112,3725,Withdrawal,2347.27,01/03/24,Bad represent thing energy.
113,2062,Deposit,4038.83,03/26/23,Computer her different commercial oil debate.
114,173,Transfer,3286.71,10/01/23,Rest age number budget.
115,2878,Withdrawal,625.11,04/01/24,Popular really end box common.
116,4866,Transfer,4647.57,11/02/23,Staff size visit summer call operation.
117,2809,Transfer,4001.91,06/06/23,Hundred question finally indeed.
118,4203,Withdrawal,1431.04,01/22/23,Enjoy today pattern.
119,2018,Transfer,4573.45,02/18/24,Certain pass tend stuff.
120,2174,Withdrawal,1834.16,12/08/23,Everything general scientist.
121,3036,Transfer,1555.48,06/10/23,Process such should design prevent.
122,1776,Deposit,46.12,11/18/24,Production quickly black join language.
123,1522,Transfer,4962,05/10/24,Various a poor wind yard bring.
124,3017,Transfer,3128.54,09/27/23,Stock name whom seat.
125,4039,Transfer,1753.03,08/09/24,Deal range glass stock.
126,1343,Withdrawal,3823.89,04/03/23,From finally fast.
127,2876,Transfer,4639.49,12/12/22,Billion off skin live put treatment.
128,4019,Deposit,2552.43,05/20/23,Few college yourself bad painting camera.
129,2419,Deposit,4819.44,01/28/23,She degree entire.
130,215,Deposit,1567.07,07/29/23,Consider open institution green.
131,537,Deposit,4991.53,07/26/23,Couple couple several local back same.
132,4860,Withdrawal,2808.85,09/11/24,Responsibility consider speech able cup simple.
133,3688,Deposit,4661.13,07/02/24,Represent follow than.
134,3017,Deposit,2406.18,04/07/23,Go best occur clear.
135,2502,Deposit,1133.71,01/02/23,Another scientist later.
136,3691,Withdrawal,2838.37,07/06/24,Season last under one themselves.
137,1416,Withdrawal,4433.03,01/23/23,Recently music political there turn data.
138,16,Transfer,3124.91,08/25/24,Candidate man set summer.
139,3804,Withdrawal,3617.57,01/02/24,Reach size bar fast television.
140,4624,Withdrawal,4637.21,05/22/24,Change market southern away.
141,336,Deposit,444.42,07/03/24,Night environmental reflect.
142,3408,Transfer,1514.67,07/07/23,Summer trade message region red company.
143,3258,Transfer,4429.31,06/15/24,Along analysis issue happy door.
144,561,Withdrawal,2412.41,03/13/23,Degree officer again thank sometimes trade.
145,4542,Transfer,178.78,01/21/23,Sometimes mention also.
146,3551,Deposit,4774.12,07/09/23,Much down left the action actually.
147,2608,Deposit,994.4,08/28/24,Analysis TV down fire walk.
148,2603,Withdrawal,2804.3,06/26/24,Rate foot player world.
149,2600,Transfer,4785.41,10/30/23,Reveal teacher open reduce bring parent.
150,562,Withdrawal,3930.96,11/22/24,Recently what truth future tonight must.
151,4003,Withdrawal,3276.9,09/20/23,Common form into.
152,2519,Transfer,701.77,08/27/24,Remember program look information suddenly.
153,2868,Transfer,436.63,09/26/24,Say sound since.
154,1518,Withdrawal,1514.4,02/10/23,Class her huge father fact how.
155,2947,Transfer,379.01,09/11/24,Avoid writer happen house high deep.
156,3673,Withdrawal,476.79,07/03/23,Both personal rest.
157,1579,Withdrawal,4501,11/11/23,Dream industry what sometimes.
158,1574,Withdrawal,3468.09,04/04/23,Sometimes another avoid.
159,3341,Transfer,1770.9,07/03/23,Explain officer probably unit continue cover.
160,727,Transfer,3172.77,08/24/24,Hit consumer medical radio.
161,4803,Deposit,3415.45,09/19/24,Add center start.
162,348,Withdrawal,1089.04,07/27/24,Other leader hair community control.
163,678,Transfer,1592.53,02/06/24,Remember discussion usually nearly world for.
164,495,Withdrawal,2143.58,06/30/23,Food from some tend and training.
165,1658,Withdrawal,566.2,08/04/24,Series remain listen whatever indicate.
166,3186,Withdrawal,3267.83,03/03/24,Decision grow notice.
167,1094,Transfer,1074.56,03/14/24,Catch term identify.
168,1295,Transfer,1884.47,10/26/23,Image up station drop amount perhaps.
169,4909,Withdrawal,1072.11,02/13/23,Situation message take white.
170,690,Withdrawal,2679.19,07/06/24,Forward evidence reason.
171,1701,Transfer,1564.25,07/01/23,Year true military against very.
172,126,Transfer,1697.87,12/06/22,Collection maybe image baby.
173,1783,Deposit,1989.75,12/19/23,Time experience partner how.
174,840,Withdrawal,2434.54,08/29/23,Election soon difficult consumer service then.
175,1604,Withdrawal,876.96,05/06/23,Wait tend another want thousand to.
176,1177,Transfer,2057.22,09/27/24,Performance look dog.
177,1169,Withdrawal,346.24,09/28/24,Answer team look near.
178,521,Deposit,205.47,07/16/23,Assume happy run.
179,1579,Withdrawal,4470.16,10/18/24,Tv stuff trade.
180,25,Transfer,1622.53,04/20/24,Hospital here protect father especially particularly.
181,3780,Withdrawal,1167.85,06/04/23,Later politics maintain voice or.
182,2902,Transfer,3019.7,09/09/23,Somebody firm manage whether economy again.
183,2465,Withdrawal,3223.7,11/22/24,American scientist late month same.
184,4678,Withdrawal,1114.46,07/01/24,Positive develop must.
185,1280,Transfer,3149.17,04/18/23,Sell party data person.
186,2813,Deposit,1411.57,12/07/22,Fly baby indeed chance.
187,4975,Deposit,3487.88,04/02/23,Fight interview wait old box.
188,511,Withdrawal,4169.54,09/28/23,Claim policy wear never American.
189,3638,Withdrawal,2105.12,10/03/23,Suggest decision class next top.
190,2036,Deposit,3961,11/17/24,Them wall condition magazine begin business.
191,1921,Deposit,4512.25,02/28/24,Administration lot red machine.
192,2442,Transfer,3784.55,01/28/24,Office save whom public moment.
193,4681,Transfer,3524.97,02/02/23,Teacher hour others computer.
194,4541,Deposit,3533.1,10/05/24,Network class sing respond position woman.
195,661,Withdrawal,4863.38,07/19/23,Crime debate put three investment all.
196,4350,Withdrawal,197.99,03/12/24,Western maintain short amount opportunity probably.
197,2143,Withdrawal,3617.89,02/21/24,Day eat suggest pattern huge cut.
198,3099,Transfer,2665.98,04/26/24,Speech gun firm.
199,2346,Withdrawal,3037.61,06/16/23,Human cup hair stand.
200,301,Transfer,2490.7,02/04/24,Speak music five.
201,584,Withdrawal,4467.82,04/13/24,People cultural first ask religious.
202,1622,Withdrawal,3297.53,05/01/23,Game sport send agent.
203,1443,Deposit,3298.28,11/11/24,During easy task mouth.
204,4124,Withdrawal,427.67,08/08/23,Spend particularly example sit structure increase.
205,3576,Transfer,4054.82,06/27/23,Economic enter stand call contain.
206,2450,Withdrawal,2440.29,05/12/23,Himself behavior power open possible.
207,2209,Transfer,4327.37,04/08/23,Level response son music all.
208,2813,Transfer,4342.64,03/22/23,Moment realize bar.
209,435,Deposit,1762.04,03/30/24,Blood center art type rate.
210,848,Deposit,271.71,10/29/24,Shoulder seem learn station.
211,4934,Withdrawal,4570.22,01/15/24,But development head.
212,2095,Deposit,2713.95,02/17/23,Attack person oil decade available listen.
213,3414,Transfer,1386.54,11/30/24,Since question especially company.
214,822,Transfer,4715.46,06/05/23,Skin wonder plant need land trip.
215,1019,Withdrawal,647.86,09/07/23,Build white Republican fall.
216,2148,Withdrawal,1866.29,11/16/24,Individual month example.
217,1761,Transfer,3424.41,04/15/24,Energy what ask actually.
218,1607,Deposit,3825.24,10/30/23,Event staff your.
219,1743,Deposit,4357.07,04/21/24,Agent stuff tonight.
220,1672,Withdrawal,4981.36,06/19/24,Example off year sometimes fight look.
221,1739,Withdrawal,4419.87,07/30/24,Country cover material source significant serve easy.
222,4266,Withdrawal,189.99,01/25/23,Shoulder consider cell its entire.
223,2901,Transfer,2096.22,04/23/24,He environment other change audience.
224,1747,Withdrawal,55.73,09/26/24,Medical suddenly modern health.
225,1919,Deposit,4336.44,10/12/24,Left easy special research suggest.
226,4167,Transfer,3915.99,12/08/22,Themselves back against.
227,1550,Deposit,4938.02,11/26/23,Economic economic risk live.
228,2688,Transfer,686.29,02/20/24,Summer laugh response day.
229,4342,Withdrawal,3554.22,04/17/24,Ground fly notice leader.
230,3734,Deposit,3449.65,07/13/23,Already course write travel.
231,1491,Transfer,4815.85,03/29/23,Ok tend knowledge.
232,1428,Withdrawal,2213.41,07/09/23,Through form despite college.
233,3023,Withdrawal,2262,12/12/22,Or go their station.
234,163,Withdrawal,4144.02,05/16/23,Find save instead enough.
235,3772,Withdrawal,781.8,03/04/24,Seek say almost feel small.
236,1796,Deposit,4930.79,10/26/23,Thought market listen color theory stuff.
237,2137,Deposit,3874.58,12/11/22,Necessary continue peace wind campaign heart.
238,1493,Deposit,4150.64,12/30/22,As agency throughout win soon oil.
239,3734,Deposit,4196.57,01/30/24,Nice action arm.
240,4597,Withdrawal,1194.71,07/20/24,Central of arrive parent.
241,296,Deposit,3666.28,07/30/24,Various want cultural country nor he.
242,3757,Withdrawal,4743.06,05/22/24,Nature factor option system ago seek.
243,109,Transfer,4532.82,10/16/24,Contain safe themselves take instead mission.
244,1160,Transfer,90.42,09/04/24,Forget any ever.
245,476,Withdrawal,849.63,12/19/22,Rate more performance interest.
246,845,Transfer,3379.21,01/07/23,Pretty once activity parent.
247,1919,Withdrawal,4224.8,02/26/24,Dinner maybe ahead public ever interview.
248,3684,Withdrawal,1012.75,12/05/22,Detail class someone themselves goal by.
249,3311,Withdrawal,922.39,03/10/23,Him dark call.
250,4363,Withdrawal,3687.34,04/04/24,Exist type Democrat management.
251,1447,Withdrawal,2911.59,06/09/24,Political recent second officer.
252,1292,Deposit,1806.45,05/20/24,Sit heart whose.
253,3060,Withdrawal,2684.31,09/24/24,About decide name actually reflect.
254,3750,Deposit,4893,12/06/23,Page into them oil nation.
255,3822,Transfer,2708.66,09/16/23,Statement individual reach.
256,2070,Withdrawal,4200.88,05/28/24,Various read thousand.
257,1268,Deposit,4828.24,08/06/23,Turn out spring rock.
258,1575,Withdrawal,4850.25,04/19/24,Foreign activity there during something development.
259,1742,Deposit,3107.57,03/27/23,Face defense theory rate.
260,4691,Transfer,764.09,10/24/23,Experience wide think understand shake thank.
261,2899,Withdrawal,747.48,01/16/23,Lawyer easy begin attorney.
262,4630,Deposit,1734.48,04/29/23,Phone agent stand inside.
263,3494,Transfer,2622.82,09/29/23,Agree assume than half student ask.
264,313,Deposit,4847.42,09/26/23,Begin medical itself lot.
265,2230,Transfer,3357.03,03/28/24,Position discover history project street.
266,4685,Withdrawal,3351.38,12/23/22,Line guy or those information somebody.
267,3666,Transfer,4108.92,09/22/24,Process reflect trip figure.
268,670,Withdrawal,3562.31,03/18/23,Medical institution election.
269,1618,Transfer,2837.1,11/03/23,Road develop perhaps less beat prepare information.
270,106,Transfer,735.76,07/26/24,Measure task above manage above person.
271,2876,Withdrawal,4719.75,11/22/23,Interesting call decide interesting.
272,3747,Deposit,1190.81,05/14/23,Radio main debate increase article land.
273,4294,Deposit,3167.01,01/21/24,Any now summer woman event town.
274,4845,Deposit,409.92,06/18/23,Able foreign the defense with.
275,3993,Deposit,2937.82,12/29/22,Cost tell week world.
276,2217,Deposit,448.29,05/03/23,Environmental friend million mention.
277,65,Transfer,3686.13,05/21/24,Claim free available.
278,1340,Withdrawal,3109.81,10/08/24,Head show soldier.
279,620,Transfer,317.64,07/20/24,Professor up exist seek.
280,2334,Transfer,1403.4,01/17/23,Owner ready ever.
281,4467,Deposit,2272.68,03/07/24,State rather trade.
282,2907,Withdrawal,2796.49,01/08/23,Yourself move provide.
283,1437,Transfer,1299.91,01/17/23,Standard father middle security.
284,1620,Withdrawal,731.05,01/23/23,Put fund participant involve president defense.
285,3530,Transfer,373.07,10/17/24,Ability race end work American just card.
286,2985,Transfer,3214.89,01/12/23,Social lay item study.
287,4636,Withdrawal,4593.14,05/18/24,Drive language station adult everyone.
288,2522,Deposit,4164.26,02/13/24,Under officer close majority six.
289,1469,Withdrawal,2585.47,02/27/24,Institution when final decision.
290,3449,Transfer,4432.97,10/29/24,Small next no almost care commercial.
291,4580,Deposit,4522.35,10/27/24,Yard finally method analysis.
292,3653,Deposit,4147.85,10/24/24,Chair amount around.
293,1300,Transfer,3974.23,01/26/23,Report energy couple under production put.
294,2446,Withdrawal,3987.36,12/30/23,Difference indeed base.
295,796,Deposit,1362.36,07/14/24,Test able go.
296,3364,Deposit,4198.54,09/13/24,Catch same effect.
297,2873,Transfer,444.4,04/07/23,Hear middle bank above this.
298,3481,Transfer,41.61,08/05/23,Girl early hear catch throw.
299,665,Transfer,3621.67,01/10/23,Hour measure share recent.
300,2798,Deposit,518.28,04/10/24,Hit parent someone.
301,235,Transfer,3931.59,10/19/23,Fill treat indeed grow.
302,4290,Withdrawal,3875.5,01/13/24,Agent manage man.
303,2845,Deposit,2867.15,02/22/24,Bit note begin finish.
304,468,Transfer,2113.63,02/02/23,Operation police customer month approach painting.
305,3325,Withdrawal,3135.95,11/25/23,Recognize onto up suffer simply.
306,2137,Transfer,3909.96,10/02/24,Child call final leader act.
307,4109,Withdrawal,3031.16,11/29/23,Usually investment space generation.
308,4186,Transfer,3389.22,09/18/24,Style question huge.
309,4912,Transfer,1667.73,06/12/24,Road respond agency home program necessary.
310,15,Deposit,3169.95,10/28/24,Generation detail magazine development poor animal.
311,1277,Withdrawal,3712.91,12/14/22,Cover there energy soon it.
312,3575,Transfer,653.15,07/17/24,She price design.
313,4318,Transfer,3355.62,01/18/23,Small government natural economic easy.
314,2923,Withdrawal,3346.59,07/27/23,Short seat laugh institution couple trip.
315,4690,Withdrawal,1906.53,05/23/24,Treatment me agreement choose create sing.
316,3966,Deposit,1019.21,06/17/24,Technology win prepare save art.
317,1474,Withdrawal,1059.58,06/06/23,Finally outside party grow project.
318,246,Transfer,2984.2,07/23/24,Expect course president know.
319,4282,Transfer,4292.15,05/07/23,Movie unit as.
320,938,Deposit,1529.71,03/16/24,Exactly drug late.
321,3512,Withdrawal,3011.06,09/12/23,Animal dog Republican opportunity new.
322,4815,Deposit,199.28,07/17/23,Sister structure decade cell.
323,1897,Withdrawal,3202.26,05/09/23,Without song visit.
324,4312,Deposit,3067.23,07/02/24,Community between bad meeting decision new.
325,4514,Deposit,1576.23,05/15/23,While show fight.
326,4282,Deposit,4511.83,07/26/23,Force nearly just represent.
327,1675,Deposit,2211.72,11/30/23,Indicate admit matter through.
328,4889,Transfer,2622.92,11/04/24,Know instead letter movie short yard.
329,1906,Withdrawal,89.88,11/27/24,Our red need big.
330,150,Deposit,2278.74,10/29/24,Or training evening.
331,3487,Transfer,2978.97,09/08/24,Really happy card seven exist class.
332,2083,Transfer,248.73,01/24/24,Agency and above drive.
333,1244,Deposit,3649.99,08/06/24,Support stuff field travel which.
334,3245,Deposit,624.57,08/25/23,Body authority financial.
335,71,Deposit,4518.62,04/05/23,Old value pressure.
336,2104,Deposit,3801.13,05/31/23,Paper race buy idea.
337,821,Withdrawal,2800.23,03/25/24,We concern of.
338,1434,Withdrawal,3284.12,07/22/24,Pressure trial yard attorney prepare both.
339,2158,Withdrawal,4250.02,01/26/24,Easy take than.
340,2589,Transfer,814.24,06/18/23,Significant business throughout else write professional.
341,3661,Withdrawal,1044.35,05/04/23,Point president responsibility.
342,4394,Deposit,490.25,05/30/23,Scientist fund out.
343,533,Transfer,1561.82,02/25/23,Three six land character enough general.
344,3424,Withdrawal,3337.39,09/12/23,Along create represent your stage both.
345,1914,Withdrawal,968.34,03/09/23,They generation technology.
346,4018,Withdrawal,3723.07,03/05/24,Together describe course son see.
347,2841,Deposit,556.48,10/17/23,Think catch however alone.
348,4749,Withdrawal,1955.41,09/15/24,Investment fish nature wonder.
349,3099,Withdrawal,3222.89,07/22/23,Recently girl choice economic action finally.
350,1013,Deposit,2466.36,11/12/23,Discussion whether son building writer.
351,4994,Withdrawal,1960.89,01/26/24,Style sport difference.
352,4350,Transfer,2765.91,01/05/24,Vote force back.
353,647,Transfer,848.79,09/09/24,Send main keep image real.
354,277,Deposit,1034.88,04/28/24,Edge painting fine.
355,1320,Withdrawal,2715.37,04/18/24,Sense fill case sometimes democratic Congress.
356,3056,Deposit,4051.78,12/06/23,You crime style project fire firm.
357,3894,Withdrawal,3306.04,06/02/24,Natural best either individual game enough perhaps.
358,405,Transfer,4362.01,04/02/24,Child office help until practice respond.
359,4304,Withdrawal,2849.52,09/09/24,Response while similar great check through anything.
360,3109,Deposit,2369.11,02/05/24,Since enjoy work.
361,3262,Withdrawal,4679.5,05/10/23,Police yeah everything everything discussion.
362,4638,Deposit,3359.13,09/19/23,Position drug son however tell whole.
363,3165,Deposit,2939.9,02/23/24,Blue beat scene official.
364,2770,Deposit,1581.62,03/17/24,Decade catch visit they anyone.
365,4288,Deposit,2064.71,11/10/24,Religious across anything individual.
366,4072,Transfer,320.14,07/21/23,Agreement structure data station.
367,3976,Transfer,3284.12,08/04/24,Letter move lose once peace.
368,948,Deposit,2511.98,09/21/24,Business out view.
369,4020,Deposit,2677.68,02/11/23,Take relationship put lot place.
370,1404,Deposit,3337.9,11/04/23,Report thing world especially pressure wall.
371,3606,Deposit,4064.26,05/18/24,Big staff road of.
372,371,Withdrawal,1127.44,04/12/23,Fly well choose generation.
373,1196,Withdrawal,155.47,03/25/24,Dream anyone recognize.
374,633,Transfer,3135.37,09/15/23,Hear either focus forward spend organization.
375,3106,Transfer,4436.77,12/25/22,Service herself reduce stay teach writer.
376,3224,Withdrawal,493.34,02/06/23,Recognize remember lose commercial Mrs development.
377,4555,Transfer,1786.85,12/18/23,Glass offer painting.
378,482,Transfer,834.3,02/22/24,View clearly each hot understand.
379,4091,Transfer,862.43,11/13/24,Hear run sometimes share issue.
380,3081,Deposit,3853.07,02/11/23,City long international bank capital.
381,3130,Withdrawal,2902.12,07/04/23,Spend doctor open especially give.
382,2740,Withdrawal,3244.94,12/10/22,Become early just similar.
383,936,Withdrawal,3845.37,06/21/24,Executive interview debate girl able trip.
384,369,Transfer,2285.69,05/18/23,Push three action.
385,3002,Withdrawal,3613.33,05/17/23,Even sport go.
386,3308,Withdrawal,330.21,02/10/23,Practice recognize including boy quickly food.
387,4985,Withdrawal,2582.62,08/15/23,Improve edge option meet other.
388,621,Transfer,2279.1,07/05/24,Plan time woman.
389,3097,Withdrawal,2909.2,07/28/24,Treat majority American herself sell suggest.
390,4214,Deposit,4285.34,02/23/24,Lose truth learn.
391,1787,Withdrawal,1112.87,03/31/23,Success raise collection response.
392,1246,Deposit,1907.4,09/27/24,Believe reveal speak explain doctor one.
